{"decision_links":[{"label":"인식보다 확인을 중심에 둔 v1","node_ids":["planning-background"],"section_id":"planning-background"},{"label":"OCR 후보를 자동 확정하지 않기","node_ids":["confirmation-flow"],"section_id":"confirmation-flow"},{"label":"개인 JSON 장부로 범위 제한","node_ids":["local-ledger-scope"],"section_id":"local-ledger-scope"},{"label":"전문 재고보다 시음과 재구매 기록","node_ids":["personal-positioning"],"section_id":"personal-positioning"},{"label":"저장 행을 와인 카드로 묶기","node_ids":["grouped-cellar-book"],"section_id":"grouped-cellar-book"},{"label":"복원 근거가 없는 기존 기록 보존","node_ids":["preserve-uncertain-history"],"section_id":"preserve-uncertain-history"}],"flows":[{"from":"planning-background","id":"flow-01","label":"다음 판단","to":"confirmation-flow"},{"from":"confirmation-flow","id":"flow-02","label":"다음 판단","to":"local-ledger-scope"},{"from":"local-ledger-scope","id":"flow-03","label":"다음 판단","to":"personal-positioning"},{"from":"personal-positioning","id":"flow-04","label":"다음 판단","to":"grouped-cellar-book"},{"from":"grouped-cellar-book","id":"flow-05","label":"다음 판단","to":"preserve-uncertain-history"},{"from":"preserve-uncertain-history","id":"flow-06","label":"구현으로 연결","to":"implementation-flow"},{"from":"implementation-flow","id":"flow-07","label":"검증","to":"validation"},{"from":"validation","id":"flow-08","label":"현재 결과","to":"limitations"}],"nodes":[{"description":"와인 라벨은 서체, 반사와 배경 때문에 한 번의 OCR 결과를 제품 사실로 쓰기 어렵다. 이 프로젝트는 사진에서 와인을 자동 등록하는 제품보다 후보를 만들고 사용자가 확인한 뒤 개인 장부에 남기는 흐름을 목표로 했다. 오인식 비용을 사용자 확인 단계에서 통제한 것이다.","id":"planning-background","kind":"guardrail","label":"인식보다 확인을 중심에 둔 v1"},{"description":"스캔 결과는 후보 목록으로만 취급하고 사용자가 와인을 확인한 뒤 저장한다. 정확도가 높아 보이는 첫 결과를 곧바로 장부에 넣는 대안은 이름이 비슷한 와인을 같은 항목으로 합칠 위험이 컸다. 제품은 속도보다 확인 가능한 입력 흐름을 택했다.","id":"confirmation-flow","kind":"state","label":"OCR 후보를 자동 확정하지 않기"},{"description":"개인 기록은 로컬 JSON에 저장한다. 계정, 다중 사용자와 기기 동기화를 먼저 만들지 않아 후보 확인과 저장, 조회와 삭제를 작은 구조에서 검증했다. 대신 동시 쓰기, 백업과 장기 내구성은 제한된다.","id":"local-ledger-scope","kind":"guardrail","label":"개인 JSON 장부로 범위 제한"},{"description":"장기 제품 방향은 전문 수집가의 재고 평가보다 개인 사용자의 시음과 재구매 기록에 뒀다. 몇 병이 남았는지보다 어떤 와인을 몇 번 마셨고 다시 선택할지에 집중한다.","id":"personal-positioning","kind":"state","label":"전문 재고보다 시음과 재구매 기록"},{"description":"Cellar Book은 저장 건마다 카드를 만들지 않고 wine ID별로 기록을 묶는다. 같은 와인을 여러 번 저장했다면 카드에는 실제 저장 횟수를 Times로 표시한다. 서로 다른 날짜 수를 Days로 보여 주던 의미를 기록 횟수로 바로잡은 변경이다.","id":"grouped-cellar-book","kind":"state","label":"저장 행을 와인 카드로 묶기"},{"description":"운영 기록에는 7번의 저장이 있지만 고유 wine ID는 3개뿐이었다. OCR 오매칭으로 서로 다른 와인이 같은 ID에 묶였을 가능성이 있어도 원본 라벨과 교정 이력이 없으면 어느 행을 어떤 와인으로 바꿔야 하는지 확정할 수 없다.","id":"preserve-uncertain-history","kind":"state","label":"복원 근거가 없는 기존 기록 보존"},{"description":"Node 서버가 simulation과 live OCR 경로, 후보, 기록 CRUD와 정적 화면을 제공한다. 사용자가 후보를 확정하면 JSON 장부에 저장되고 프런트는 wine ID별로 기록을 그룹화해 횟수와 상세 이력을 보여 준다.","id":"implementation-flow","kind":"process","label":"스캔에서 장부 카드까지"},{"description":"과거 검증 harness에는 서버 시작, 메타 조회, simulation scan, 기록 생성, 조회와 삭제를 실제 API로 통과한 결과가 있다. 당시 원격 상태에서 7개 기록과 3개 고유 ID를 확인하고 표시 의미를 수정한 기록도 남아 있다.","id":"validation","kind":"guardrail","label":"API 흐름과 현재 화면의 검증 경계"},{"description":"서로 다른 와인이 같은 ID로 저장되면 카드 묶음과 횟수가 함께 왜곡된다. 원본 라벨, OCR 후보와 사용자의 교정 이력을 남기지 않은 기존 기록은 사후 복원이 어렵다. 현재 보존 결정은 데이터를 고친 것이 아니라 근거 없는 변경을 피한 것이다.","id":"limitations","kind":"output","label":"오매칭 이후 복구의 한계"}],"project_id":"260401-wine-cellar-scan","summary":"OCR 결과를 자동 확정하지 않고 사용자가 후보를 검토한 뒤 개인 시음 기록으로 저장하며, 복원할 근거가 없는 기존 오매칭은 추정 수정하지 않은 v1의 선택을 정리한다.","title":"라벨 후보를 확인해 남기는 와인 장부: 구조와 결정 흐름"}
