{"decision_links":[{"label":"후보 선택을 3명에서 10명으로 제한","node_ids":["bounded-selection"],"section_id":"bounded-selection"},{"label":"외모와 성격 분석을 별도 단계로","node_ids":["split-analysis"],"section_id":"split-analysis"},{"label":"구조화 결과와 demo fallback","node_ids":["structured-fallback"],"section_id":"structured-fallback"},{"label":"분석을 소개 패키지로 확장","node_ids":["editorial-output"],"section_id":"editorial-output"},{"label":"자동 매칭 대신 운영자 검토","node_ids":["manual-curation"],"section_id":"manual-curation"}],"flows":[{"from":"bounded-selection","id":"flow-01","label":"다음 판단","to":"split-analysis"},{"from":"split-analysis","id":"flow-02","label":"다음 판단","to":"structured-fallback"},{"from":"structured-fallback","id":"flow-03","label":"다음 판단","to":"editorial-output"},{"from":"editorial-output","id":"flow-04","label":"다음 판단","to":"manual-curation"},{"from":"manual-curation","id":"flow-05","label":"구현으로 연결","to":"implementation-flow"},{"from":"implementation-flow","id":"flow-06","label":"검증","to":"validation"},{"from":"validation","id":"flow-07","label":"현재 결과","to":"limitations"}],"nodes":[{"description":"한 번에 비교할 후보는 최소 3명, 최대 10명으로 제한했다. 후보가 너무 적으면 공통 선호를 찾기 어렵고 무제한이면 각 선택의 이유를 기억하기 어렵다. 수집량보다 비교 가능한 입력 범위를 택한 결정이다.","id":"bounded-selection","kind":"guardrail","label":"후보 선택을 3명에서 10명으로 제한"},{"description":"외모와 성격을 하나의 점수로 합치지 않고 별도 탭, 선택과 결과로 분리했다. 서로 다른 판단 근거를 같은 축으로 섞으면 사용자가 왜 결과가 나왔는지 설명하기 어렵기 때문이다. 두 분석이 모두 끝나면 종합 요약을 자동 생성해 사용자가 별도 병합을 반복하지 않게 했다.","id":"split-analysis","kind":"guardrail","label":"외모와 성격 분석을 별도 단계로"},{"description":"분석 결과는 화면이 안정적으로 소비할 수 있는 구조로 받는다. 외부 모델 설정이 없거나 호출이 실패할 때는 local 또는 demo 결과를 사용해 후보 선택부터 결과 화면까지의 UX를 계속 확인할 수 있게 했다.","id":"structured-fallback","kind":"guardrail","label":"구조화 결과와 demo fallback"},{"description":"결과를 선호 설명 텍스트로 끝내지 않고 생성 초상과 Curator Match Pack으로 확장했다. 선택 근거, 종합 설명과 이미지 콘셉트를 한 묶음으로 만들어 운영자가 소개를 검토할 수 있게 했다.","id":"editorial-output","kind":"process","label":"분석을 소개 패키지로 확장"},{"description":"분석 결과만으로 사용자를 자동 연결하지 않는다. 신청 단계에서 표시명, 연락 방법과 동의를 받고 운영자가 큐레이션 큐에서 검토한다. 관리 화면은 신청 조회와 XLS 내보내기를 제공해 수동 운영을 지원한다.","id":"manual-curation","kind":"interface","label":"자동 매칭 대신 운영자 검토"},{"description":"단일 Node 서버가 정적 사용자 화면과 관리자 화면, 검색, 분석, 이미지, match pack과 신청 API를 제공한다. 사용자 화면은 검색 후보와 선택 후보를 분리하고 외모와 성격 단계를 진행한다. 완료된 결과는 소개 패키지와 수동 신청으로 이어진다.","id":"implementation-flow","kind":"process","label":"선택에서 운영 큐까지"},{"description":"현재 서버, 사용자 화면과 관리자 화면의 JavaScript 문법을 확인했다. 구현 로그에는 과거 health 응답과 주요 endpoint를 호출한 기록이 있다. 자동 테스트와 현재 서버 전체 실행은 없다.","id":"validation","kind":"guardrail","label":"현재 문법과 과거 endpoint 확인"},{"description":"표시명과 연락 방법, 동의 기록의 최소 수집, 암호화, 보존과 삭제 정책이 부족하다. 단순 관리자 인증은 공개 운영 강도로 충분하지 않고, 여러 운영자의 권한과 변경 감사도 없다.","id":"limitations","kind":"output","label":"신청 데이터를 다루기 전의 과제"}],"project_id":"260408-ideal-type-editorial","summary":"후보 탐색, 외모와 성격 분석, 생성 초상과 소개 패키지를 단계로 나누고 자동 매칭 대신 동의 기반 운영자 큐레이션을 선택한 에디토리얼 MVP를 정리한다.","title":"선호 분석과 수동 큐레이션을 잇는 도구: 구조와 결정 흐름"}
