{"decision_links":[{"label":"명확한 요청은 dictionary가 먼저 처리","node_ids":["dictionary-first"],"section_id":"dictionary-first"},{"label":"family 선택과 expert 실행 분리","node_ids":["family-then-expert"],"section_id":"family-then-expert"},{"label":"selector를 저신뢰 예외로 제한","node_ids":["bounded-selector"],"section_id":"bounded-selector"},{"label":"prompt 규칙과 후처리 효과 분리","node_ids":["rules-and-normalization"],"section_id":"rules-and-normalization"},{"label":"Stage 2 owner 선택 26/100","node_ids":["owner-failure"],"section_id":"owner-failure"},{"label":"expert 결과 계약은 별도 평가","node_ids":["result-contract"],"section_id":"result-contract"},{"label":"실패 행과 평가 조건 보존","node_ids":["failure-policy"],"section_id":"failure-policy"}],"flows":[{"from":"dictionary-first","id":"flow-01","label":"다음 판단","to":"family-then-expert"},{"from":"family-then-expert","id":"flow-02","label":"다음 판단","to":"bounded-selector"},{"from":"bounded-selector","id":"flow-03","label":"다음 판단","to":"rules-and-normalization"},{"from":"rules-and-normalization","id":"flow-04","label":"검증","to":"operational-sample"},{"from":"operational-sample","id":"flow-05","label":"다음 판단","to":"owner-failure"},{"from":"owner-failure","id":"flow-06","label":"다음 판단","to":"result-contract"},{"from":"result-contract","id":"flow-07","label":"다음 판단","to":"failure-policy"},{"from":"failure-policy","id":"flow-08","label":"현재 결과","to":"limitations"}],"nodes":[{"description":"exact match나 높은 신뢰의 로컬 사전 경로를 LLM보다 앞에 둔다. 이미 정해진 기기 명령까지 매번 생성 모델에 맡기지 않아 비용과 명백한 route 오류를 줄이는 선택이다.","id":"dictionary-first","kind":"service","label":"명확한 요청은 dictionary가 먼저 처리"},{"description":"모든 expert를 한 번에 경쟁시키는 대신 Stage 1이 처리 family를 먼저 정한다. 고신뢰이면 한 specialist만 실행해 지연을 줄이고, specialist는 자기 도메인의 구조화 결과를 소유한다.","id":"family-then-expert","kind":"guardrail","label":"family 선택과 expert 실행 분리"},{"description":"selector는 항상 호출되는 마지막 LLM이 아니다. family 신뢰도가 낮고 허용된 두 후보를 실행한 경우에만 어느 결과를 채택할지 결정한다.","id":"bounded-selector","kind":"guardrail","label":"selector를 저신뢰 예외로 제한"},{"description":"few-shot 예시를 계속 늘리는 대신 capability와 반복 가능한 분류 규칙을 prompt에 둔다. 표기 차이와 명백한 출력 변형은 deterministic normalization으로 보정하되, prompt-only 수치와 합산하지 않는다.","id":"rules-and-normalization","kind":"guardrail","label":"prompt 규칙과 후처리 효과 분리"},{"description":"월별 500행씩 모은 총 1,500행 표본의 과거 prompt-only 결과는 1,316/1,500, 87.73%였다. 소형 세트 97.81%와 차이가 커서 작은 평가만으로 운영 분포를 대표할 수 없음을 보여준다.","id":"operational-sample","kind":"guardrail","label":"운영 표본은 별도 조건으로 해석"},{"description":"100행 Stage 2 owner 선택 실험은 원래 judge의 quota 문제로 다른 judge를 사용한 조건에서 26/100이었다. 특정 family를 과하게 고르고 정답 후보를 누락하는 문제가 남아 있어 명백한 below-gate다.","id":"owner-failure","kind":"guardrail","label":"Stage 2 owner 선택 26/100"},{"description":"seed 두 개에서 각 200행을 실행한 별도 평가는 pass 95.25%, partial 0.75%, fail 2%, empty 2%였다. 이는 선택된 expert가 요구된 구조와 내용을 반환하는지 본 평가다.","id":"result-contract","kind":"process","label":"expert 결과 계약은 별도 평가"},{"description":"일시적인 provider 오류는 제한적으로 재시도하지만 최종 실패를 빈 성공 행으로 바꾸지 않는다. error와 empty를 별도 집계해 batch 완주율과 내용 품질을 분리한다.","id":"failure-policy","kind":"guardrail","label":"실패 행과 평가 조건 보존"},{"description":"Stage 2 owner 선택 26/100은 해결되지 않았다. 현재 full cross-validation summary도 총 0행이어서 CV 완료 근거가 없다. 과거 고정 holdout과 후속 표본 결과는 현재 dirty 작업 상태의 release 증거가 아니다.","id":"limitations","kind":"output","label":"완료로 볼 수 없는 상태"}],"project_id":"260315-moe-prompt-routing","summary":"dictionary, family classifier, specialist와 selector의 책임을 나누고 라우팅과 결과 계약을 별도 평가한 과정 및 Stage 2 미달 상태를 정리한다.","title":"계층형 음성 라우팅과 평가 경계 정리: 구조와 결정 흐름"}
