{"decision_links":[{"label":"slot 상태를 다섯 집합으로 분리","node_ids":["slot-model"],"section_id":"slot-model"},{"label":"alias와 dependency를 별도 규칙으로 관리","node_ids":["alias-dependency"],"section_id":"alias-dependency"},{"label":"조건 조합 하나를 한 행으로 유지","node_ids":["one-condition-row"],"section_id":"one-condition-row"},{"label":"수정 조합은 generator가 생성","node_ids":["generator-ownership"],"section_id":"generator-ownership"},{"label":"positive는 source span을 필수화","node_ids":["positive-data"],"section_id":"positive-data"},{"label":"negative는 route별 경계를 설계","node_ids":["negative-data"],"section_id":"negative-data"},{"label":"command는 action family를 먼저 본다","node_ids":["command-family"],"section_id":"command-family"},{"label":"command coverage 157/176","node_ids":["command-gap"],"section_id":"command-gap"},{"label":"이전 형식을 archive로 보존","node_ids":["archive-and-rollback"],"section_id":"archive-and-rollback"}],"flows":[{"from":"slot-model","id":"flow-01","label":"다음 판단","to":"alias-dependency"},{"from":"alias-dependency","id":"flow-02","label":"다음 판단","to":"one-condition-row"},{"from":"one-condition-row","id":"flow-03","label":"다음 판단","to":"generator-ownership"},{"from":"generator-ownership","id":"flow-04","label":"검증","to":"schedule-output"},{"from":"schedule-output","id":"flow-05","label":"다음 판단","to":"positive-data"},{"from":"positive-data","id":"flow-06","label":"다음 판단","to":"negative-data"},{"from":"negative-data","id":"flow-07","label":"다음 판단","to":"command-family"},{"from":"command-family","id":"flow-08","label":"다음 판단","to":"command-gap"},{"from":"command-gap","id":"flow-09","label":"다음 판단","to":"archive-and-rollback"},{"from":"archive-and-rollback","id":"flow-10","label":"현재 결과","to":"limitations"}],"nodes":[{"description":"slot을 required, optional, disabled, inferred, changeable로 나눈다. 발화에 없어도 규칙으로 채워지는 값과 수정 가능한 값을 필수 slot에 섞지 않는다.","id":"slot-model","kind":"guardrail","label":"slot 상태를 다섯 집합으로 분리"},{"description":"canonical value와 다양한 표현은 term dictionary에 모은다. 하위 조건의 parent-child 관계와 생략 허용은 dependency rule로 분리해 각 테스트 행에 반복하지 않는다.","id":"alias-dependency","kind":"guardrail","label":"alias와 dependency를 별도 규칙으로 관리"},{"description":"한 조건 조합을 여러 행으로 흩뜨리지 않고 문장형, 키워드형, fragment와 alias 발화를 같은 행에 묶는다. 생성 다양성과 정답 조건을 분리해 사람이 한눈에 비교할 수 있다.","id":"one-condition-row","kind":"guardrail","label":"조건 조합 하나를 한 행으로 유지"},{"description":"사람이 가능한 change slot 조합을 모두 직접 쓰지 않는다. changeable slots와 pattern type에서 generator가 수정 발화를 파생한다.","id":"generator-ownership","kind":"process","label":"수정 조합은 generator가 생성"},{"description":"schedule matrix 산출물은 2,641행이며 현재 worklog는 조건당 한 행과 주요 발화 공백이 없다고 기록한다. 이는 matrix와 generator가 계약대로 파일을 만들었다는 증거다.","id":"schedule-output","kind":"guardrail","label":"schedule matrix 2,641행"},{"description":"문서에서 답할 수 있는 질문만 만들고 source span, intent, tone과 answerable을 함께 남긴다. 현재 산출물은 673행이며 8개 source coverage, 중복과 CSV·JSONL 일치를 검사한다.","id":"positive-data","kind":"state","label":"positive는 source span을 필수화"},{"description":"unsupported, 일반 대화, 외부 지식과 공격·민감 경계를 route quota로 나누고 중복, 길이와 금지 패턴을 검사한다. 현재 산출물은 500행이다.","id":"negative-data","kind":"guardrail","label":"negative는 route별 경계를 설계"},{"description":"표면 동사가 비슷하더라도 이동, 복귀, 상태 조회와 설정 변경에는 서로 다른 표현 제약이 필요하다. action family를 먼저 정하고 대표 intent-token마다 최소 10개를 생성한다.","id":"command-family","kind":"state","label":"command는 action family를 먼저 본다"},{"description":"초기 범위는 73개에서 157개로 넓어졌지만 후속 검토에서 수행 불가 항목만 제외한 대표 기준은 약 176개로 정정됐다. 원본 generator는 실제 기기 동작이 `명령 수행` 또는 `상태 확인`인 항목만 통과시키므로 현재 산출물은 여전히 157개 기준이다.","id":"command-gap","kind":"state","label":"command coverage 157/176"},{"description":"v0 입력과 결과를 삭제하지 않고 archive로 옮겨 최신 형식과 분리했다. 확정 matrix와 충돌하는 참고 prompt는 우선순위에서 내리고 matrix와 정책을 기준으로 삼는다.","id":"archive-and-rollback","kind":"guardrail","label":"이전 형식을 archive로 보존"},{"description":"command는 157/176으로 미달이고 positive source span의 사람 정답성 감사가 없다. 생성 문장의 자연스러움, 실제 router 정확도와 RAG 답변 품질도 별도 평가가 필요하다.","id":"limitations","kind":"output","label":"생성 통과 이후의 gate"}],"project_id":"260626-make-test-set","summary":"사람이 검토하는 slot matrix와 생성기 규칙을 분리하고 schedule, positive, negative, command 데이터의 품질 gate와 157/176 coverage 미달을 정리한다.","title":"한국어 테스트셋 생성 규칙 정리: 구조와 결정 흐름"}
