{"decision_links":[{"label":"자유형 보고 대신 HANDOFF_PACKET 채택","node_ids":["structured-handoff"],"section_id":"structured-handoff"},{"label":"구현자에게 EXECUTION_PLAN을 요구","node_ids":["executable-plan"],"section_id":"executable-plan"},{"label":"구현 검증과 사용자 수용 검증을 분리","node_ids":["split-sqe-sqa"],"section_id":"split-sqe-sqa"},{"label":"로컬 UI는 preview 없이 완료로 인정하지 않음","node_ids":["preview-completion-gate"],"section_id":"preview-completion-gate"},{"label":"Python orchestrator와 Codex CLI backend로 전환","node_ids":["switch-to-cli-backend"],"section_id":"switch-to-cli-backend"},{"label":"재작업과 종료 상태를 분리","node_ids":["termination-semantics"],"section_id":"termination-semantics"},{"label":"프로젝트 문서와 workspace 실행기를 분리","node_ids":["split-document-runner"],"section_id":"split-document-runner"}],"flows":[{"from":"structured-handoff","id":"flow-01","label":"다음 판단","to":"executable-plan"},{"from":"executable-plan","id":"flow-02","label":"다음 판단","to":"split-sqe-sqa"},{"from":"split-sqe-sqa","id":"flow-03","label":"다음 판단","to":"preview-completion-gate"},{"from":"preview-completion-gate","id":"flow-04","label":"다음 판단","to":"switch-to-cli-backend"},{"from":"switch-to-cli-backend","id":"flow-05","label":"다음 판단","to":"termination-semantics"},{"from":"termination-semantics","id":"flow-06","label":"다음 판단","to":"split-document-runner"},{"from":"split-document-runner","id":"flow-07","label":"구현으로 연결","to":"architecture-flow"},{"from":"architecture-flow","id":"flow-08","label":"검증","to":"execution-history"},{"from":"execution-history","id":"flow-09","label":"검증","to":"failed-wiring"},{"from":"failed-wiring","id":"flow-10","label":"현재 결과","to":"current-status"}],"nodes":[{"description":"각 단계가 설명문만 남기지 않고 현재 stage, status, 다음 담당, 차단 이슈, 산출물과 다음 action을 구조화된 packet으로 넘기게 했다. 보고서 끝의 packet이 다음 단계 입력이 되도록 해 사람에게 보이는 요약과 실행용 상태가 갈라지지 않게 설계했다.","id":"structured-handoff","kind":"state","label":"자유형 보고 대신 HANDOFF_PACKET 채택"},{"description":"구현 단계는 텍스트 설명만으로 통과할 수 없게 하고 `write_files`, `run_commands`, 필요 시 `start_servers`를 포함한 실행 계획을 요구했다. Python orchestrator가 이 계획을 해석해 실제 파일 쓰기와 명령, preview server 기동을 수행하는 구조였다.","id":"executable-plan","kind":"service","label":"구현자에게 EXECUTION_PLAN을 요구"},{"description":"SQE는 build, test, 명령 실행과 서버 기동처럼 기술 조건을 확인하고, SQA는 최종 사용자가 요구한 결과인지 판단하도록 나눴다. 한 gate에서 두 역할을 섞으면 “코드는 실행되지만 요구와 다름”과 “요구는 맞지만 실행되지 않음”을 구분하기 어렵기 때문이다.","id":"split-sqe-sqa","kind":"guardrail","label":"구현 검증과 사용자 수용 검증을 분리"},{"description":"파일이 생성되고 단위 테스트가 통과해도 사용자가 화면을 열 수 없으면 로컬 UI 작업은 완료가 아니다. 목표에 local 또는 localhost가 포함되면 preview URL을 필수 산출물로 만들고, SQE PASS와 URL이 함께 있어야 SQA로 넘어가도록 했다.","id":"preview-completion-gate","kind":"interface","label":"로컬 UI는 preview 없이 완료로 인정하지 않음"},{"description":"하네스는 Python이 전체 state loop를 관리하고 각 step의 응답은 Codex CLI가 생성하는 구조로 정리됐다. orchestrator는 응답의 packet과 execution plan을 파싱하고 실제 실행을 담당한다. 모델 호출과 로컬 작업 집행을 한 프로세스에 숨기지 않은 것이다.","id":"switch-to-cli-backend","kind":"service","label":"Python orchestrator와 Codex CLI backen..."},{"description":"현재 프로젝트가 직접 입증하는 실행 이력은 한 단계 smoke가 `READY_FOR_NEXT`로 끝나고 다음 담당을 manager로 지정한 기록이다. 이는 다음 owner로 넘길 packet을 만들었다는 뜻이지 전체 루프가 제품을 완성했다는 뜻이 아니다.","id":"termination-semantics","kind":"guardrail","label":"재작업과 종료 상태를 분리"},{"description":"프로젝트 README는 runner, protocol과 역할별 skill을 핵심 파일로 설명한다. 그러나 이번 Atlas 근거 세트에는 그 runner의 현재 코드나 runtime summary가 포함되지 않았다. 그래서 문서에 적힌 구조를 현재 실행 가능한 package로 승격해 설명하지 않는다.","id":"split-document-runner","kind":"guardrail","label":"프로젝트 문서와 workspace 실행기를 분리"},{"description":"목표를 shaping한 뒤 manager가 architect와 implementer로 넘기고, implementer의 계획에서 파일 쓰기·명령·서버 작업이 실행된다. SQE가 기술 증거와 preview를 검사하고 SQA가 사용자 수용을 판정한다. 실패하면 manager로 돌아가고 성공하면 `final_result.md`와 최신 run pointer를 남긴다.","id":"architecture-flow","kind":"process","label":"설계된 실행 흐름"},{"description":"저장된 handoff는 한 단계 smoke가 `READY_FOR_NEXT`로 끝나고 다음 담당을 manager로 지정한 기록이다. packet 생성 한 건은 확인되지만 전체 제품 완주나 반복 실행의 성공을 뜻하지 않는다.","id":"execution-history","kind":"guardrail","label":"부분 실행 기록과 실패 해석"},{"description":"문서는 `scripts/run_execution_harness.py`, `skills/HANDOFF_PROTOCOL.md`와 역할별 skill을 핵심 파일로 요구한다. 하지만 이 Atlas 글에는 해당 runner의 현재 wiring을 입증하는 원본 코드·테스트가 없으므로 초기화 성공이나 자동 순환을 주장할 수 없다.","id":"failed-wiring","kind":"guardrail","label":"현재 동작하지 않는 wiring"},{"description":"이 프로젝트의 정확한 상태는 완성된 자동화가 아니라 문서 완료와 실제 완료를 구분하려 만든 실행 계약의 역사 자산이다. 구조화된 handoff, 실행 계획, 이중 QA, preview gate와 재작업 semantics는 재사용할 가치가 있다.","id":"current-status","kind":"output","label":"legacy 상태와 남은 설계 가치"}],"project_id":"260405-execution-harness-system","summary":"보고서만 남고 구현이 멈추는 문제를 구조화된 handoff, 실행 계획과 이중 QA로 막으려 했던 설계와 실제 부분 실행, 현재 끊어진 wiring과 legacy 상태를 구분해 정리한다.","title":"멀티 에이전트 실행 하네스의 상태와 품질 게이트: 구조와 결정 흐름"}
