{"decision_links":[{"label":"단어 수보다 다시 만날 순서","node_ids":["planning-background"],"section_id":"planning-background"},{"label":"신규 진도보다 복습 우선","node_ids":["review-first-selection"],"section_id":"review-first-selection"},{"label":"연속 정답으로 복습 단계 계산","node_ids":["mastery-state"],"section_id":"mastery-state"},{"label":"정규화와 동의어 뒤에 의미 유사도 사용","node_ids":["answer-evaluation"],"section_id":"answer-evaluation"},{"label":"진행 상태와 오답 강도를 함께 표시","node_ids":["progress-board"],"section_id":"progress-board"},{"label":"로그아웃 보존과 로그인 병합","node_ids":["sync-merge"],"section_id":"sync-merge"},{"label":"답 제출 때 전체 화면 재생성 중단","node_ids":["stable-rendering"],"section_id":"stable-rendering"}],"flows":[{"from":"planning-background","id":"flow-01","label":"다음 판단","to":"review-first-selection"},{"from":"review-first-selection","id":"flow-02","label":"다음 판단","to":"mastery-state"},{"from":"mastery-state","id":"flow-03","label":"다음 판단","to":"answer-evaluation"},{"from":"answer-evaluation","id":"flow-04","label":"다음 판단","to":"progress-board"},{"from":"progress-board","id":"flow-05","label":"다음 판단","to":"sync-merge"},{"from":"sync-merge","id":"flow-06","label":"다음 판단","to":"stable-rendering"},{"from":"stable-rendering","id":"flow-07","label":"구현으로 연결","to":"implementation-flow"},{"from":"implementation-flow","id":"flow-08","label":"검증","to":"validation"},{"from":"validation","id":"flow-09","label":"현재 결과","to":"limitations"}],"nodes":[{"description":"이 앱은 28일 안에 새 단어를 많이 넘기는 것보다 틀린 단어와 복습 시점이 온 단어를 다시 만나게 하는 데 초점을 옮겼다. 데이터 범위는 N5에서 N1까지 7,493단어로 넓어졌지만, 단어 수 확대가 데이터 품질이나 학습 효과를 자동으로 보증하지 않는다.","id":"planning-background","kind":"process","label":"단어 수보다 다시 만날 순서"},{"description":"책의 day를 채우는 신규 우선 방식에서는 완료율이 오르지 않고 한 번 맞힌 카드가 다시 나타나지 않는 문제가 있었다. 이를 철회하고 직전 오답 전체, due 전체, 2회 전 오답 10개, 3회 전 5개, 4회 전 5개, 신규 최대 10개, 오래 보지 않은 카드 순으로 세션을 만든다.","id":"review-first-selection","kind":"process","label":"신규 진도보다 복습 우선"},{"description":"stage는 누적 정답 수가 아니라 연속 정답을 기준으로 한다. 3일, 7일, 10일 간격으로 복습하고 네 번 연속 성공하면 archive로 보낸다. 중간 오답이 있어도 총 정답만 높으면 빨리 졸업하는 대안을 피했다.","id":"mastery-state","kind":"process","label":"연속 정답으로 복습 단계 계산"},{"description":"답안은 먼저 문자열 정규화와 동의어 목록으로 판정하고, 이 규칙으로 판단하기 어려운 경우 서버의 임베딩 의미 유사도를 보조로 사용한다. 모든 답을 외부 생성 모델에 보내는 방식보다 비용과 지연을 줄이고 반복 가능한 첫 판정을 남긴다.","id":"answer-evaluation","kind":"service","label":"정규화와 동의어 뒤에 의미 유사도 사용"},{"description":"전체 단어 보드는 진행 중, 완료와 오답으로 나누고 오답 횟수가 많을수록 강조를 높인다. 이후 정답 수가 오답 수보다 하나 많아지면 오답 강조를 제거해 오래된 실수를 영구 낙인처럼 남기지 않는다.","id":"progress-board","kind":"state","label":"진행 상태와 오답 강도를 함께 표시"},{"description":"비로그인 상태는 localStorage, 로그인 상태는 로컬과 계정 서버에 저장한다. 로그아웃할 때 로컬 학습 기록을 모두 지우는 안은 사용자 확인 뒤 채택하지 않았다. 다시 비로그인으로 돌아와도 기기 기록을 유지한다.","id":"sync-merge","kind":"service","label":"로그아웃 보존과 로그인 병합"},{"description":"답을 제출할 때 전체 root를 다시 그리면 nav와 인증 헤더가 깜박이고 설정 초기화가 반복될 수 있었다. nav는 유지하고 학습 본문 중심으로 렌더하도록 수정했다. 이니셜 avatar와 인증 설정 재시도도 추가해 로그인 상태가 늦게 오는 경우를 보완했다.","id":"stable-rendering","kind":"state","label":"답 제출 때 전체 화면 재생성 중단"},{"description":"정적 브라우저 앱이 급수별 단어 데이터, 카드 상태와 세션 selection을 관리한다. Node 서버는 인증, 계정 상태 JSON과 임베딩 의미 판정을 제공한다. 비로그인은 로컬만 사용하고 로그인 시 로컬 상태와 계정 snapshot을 병합한다.","id":"implementation-flow","kind":"process","label":"학습 선택과 계정 저장 구조"},{"description":"과거 작업 기록에는 진행도 보존, 요청 크기 제한, 병합, 페이지네이션, 복습 우선과 인증 헤더 수정 때마다 문법 검사, 서버 시작과 원격 반영을 확인한 흔적이 있다. 이는 각 변경 시점의 실행 기록이다.","id":"validation","kind":"guardrail","label":"과거 배포 흔적과 현재 문법 확인"},{"description":"N1과 N2를 포함한 OCR 기반 단어 데이터의 중복과 오류를 전수 검증하지 않았다. 임베딩 임계값의 정밀도, 첫 로드 지연과 오답 설명도 남아 있다. 개발용 세션 fallback과 JSON 저장은 공개 운영의 인증 및 동시성 요구에 충분하지 않다.","id":"limitations","kind":"output","label":"데이터와 동기화에 남은 과제"}],"project_id":"260418-japanese-word-study","summary":"JLPT N5부터 N1까지의 단어를 신규 진도보다 오답과 due 복습에 우선 배치하고, 연속 정답 단계와 local 계정 병합, 의미 유사도 보조 판정을 결합한 학습 앱을 정리한다.","title":"복습 우선으로 다시 짠 일본어 단어 학습: 구조와 결정 흐름"}
