{"decision_links":[{"label":"대표 지시를 단일 intake로 접수","node_ids":["single-intake"],"section_id":"single-intake"},{"label":"report-only와 구현 업무 분리","node_ids":["handoff-mode"],"section_id":"handoff-mode"},{"label":"실행 전에 대표 승인","node_ids":["human-approval"],"section_id":"human-approval"},{"label":"부서별 stage와 report 통합","node_ids":["stage-ownership"],"section_id":"stage-ownership"},{"label":"dispatch 전에 runtime 검사","node_ids":["runtime-preflight"],"section_id":"runtime-preflight"},{"label":"요청한 경로가 실제로 생겼는지 확인","node_ids":["path-proof"],"section_id":"path-proof"},{"label":"미완료 업무가 있으면 퇴근 차단","node_ids":["checkout-gate"],"section_id":"checkout-gate"},{"label":"timeout 이후 정리는 사람이 결정","node_ids":["timeout-cleanup"],"section_id":"timeout-cleanup"}],"flows":[{"from":"single-intake","id":"flow-01","label":"다음 판단","to":"handoff-mode"},{"from":"handoff-mode","id":"flow-02","label":"다음 판단","to":"human-approval"},{"from":"human-approval","id":"flow-03","label":"다음 판단","to":"stage-ownership"},{"from":"stage-ownership","id":"flow-04","label":"다음 판단","to":"runtime-preflight"},{"from":"runtime-preflight","id":"flow-05","label":"다음 판단","to":"path-proof"},{"from":"path-proof","id":"flow-06","label":"다음 판단","to":"checkout-gate"},{"from":"checkout-gate","id":"flow-07","label":"다음 판단","to":"timeout-cleanup"},{"from":"timeout-cleanup","id":"flow-08","label":"검증","to":"validation"},{"from":"validation","id":"flow-09","label":"현재 결과","to":"limitations"}],"nodes":[{"description":"CEO 명령은 비서 역할의 단일 intake가 먼저 받는다. 자율적인 agent 대화보다 명시적 지시를 우선하고, 승인 전에는 read-only 분석만 수행한다.","id":"single-intake","kind":"guardrail","label":"대표 지시를 단일 intake로 접수"},{"description":"분석이나 조사로 끝나는 요청은 report-only로, 실제 파일 변경이 필요한 요청은 implementation-required로 정규화한다. report-only 업무에 구현 agent를 불필요하게 호출하지 않는다.","id":"handoff-mode","kind":"guardrail","label":"report-only와 구현 업무 분리"},{"description":"기획 결과가 나왔다는 이유로 구현을 자동 시작하지 않는다. 대표가 범위와 방향을 승인한 뒤에만 실제 code agent를 dispatch한다.","id":"human-approval","kind":"guardrail","label":"실행 전에 대표 승인"},{"description":"기획, 설계, 구현과 QA가 각자의 stage 상태를 소유한다. 결과는 하나의 업무 report에 모아 어떤 판단이 다음 단계의 입력이 됐는지 확인한다.","id":"stage-ownership","kind":"state","label":"부서별 stage와 report 통합"},{"description":"구현 agent CLI와 sandbox 지원을 실행 전에 확인한다. 잘못된 runtime이면 agent를 시작한 뒤 timeout을 기다리지 않고 blocked report를 만든다.","id":"runtime-preflight","kind":"state","label":"dispatch 전에 runtime 검사"},{"description":"사용자가 출력 위치를 명시한 경우 agent stdout의 성공 문구를 믿지 않고 해당 경로의 실재를 검사한다. 다른 파일을 만들고 완료라고 보고해도 요청 경로가 없으면 failed다.","id":"path-proof","kind":"process","label":"요청한 경로가 실제로 생겼는지 확인"},{"description":"pending approval, running, failed 또는 blocked 실행이 남으면 day completion을 허용하지 않는다. 화면에서 완료처럼 보여도 해결되지 않은 상태가 하나라도 있으면 정리 단계로 넘어가지 않는다.","id":"checkout-gate","kind":"guardrail","label":"미완료 업무가 있으면 퇴근 차단"},{"description":"개발 업무 10분, 문서 업무 5분을 기준으로 병목을 표시하지만 자동 성공이나 자동 삭제로 처리하지 않는다. 대표가 더 기다릴지, 실패로 닫을지, 삭제할지 선택한다.","id":"timeout-cleanup","kind":"guardrail","label":"timeout 이후 정리는 사람이 결정"},{"description":"현재 소스에는 engine 9개, pipeline 7개, rendered/integration 3개로 총 19개 테스트 선언이 있다. 각 테스트 파일의 선언을 직접 집계한 값이며 이번 글 작성에서 suite 전체를 재실행하지 않았다.","id":"validation","kind":"guardrail","label":"19개 테스트 선언과 검증 범위"},{"description":"실제 code agent, 외부 보고 서비스, 권한과 네트워크는 live 검증이 필요하다. 로컬 server가 여러 프로젝트를 scan하고 명령을 실행하므로 운영 환경에서는 대상 경로 allowlist와 인증 경계도 확인해야 한다.","id":"limitations","kind":"output","label":"운영 환경에 남은 경계"}],"project_id":"260803-ai-office","summary":"대표 지시를 intake, 승인, 실행, QA와 보고 상태로 나누고 agent의 완료 문구가 아닌 실제 경로와 테스트로 완료를 판정하는 운영 도구를 정리한다.","title":"AI 업무 승인과 실행 검증 구조: 구조와 결정 흐름"}
