{"decision_links":[{"label":"후속 기능을 하나의 제품과 원장으로 통합","node_ids":["common-product-boundary"],"section_id":"common-product-boundary"},{"label":"사용자 경계와 모바일 세션 전달","node_ids":["identity-and-session"],"section_id":"identity-and-session"},{"label":"음성과 텍스트가 같은 기억을 사용","node_ids":["realtime-conversation"],"section_id":"realtime-conversation"},{"label":"개인화 프롬프트와 프로필 변화 제어","node_ids":["profile-evolution"],"section_id":"profile-evolution"},{"label":"미래 캡슐의 예약과 공유 재정렬","node_ids":["capsule-scheduling"],"section_id":"capsule-scheduling"},{"label":"미션과 보상의 중복 방지","node_ids":["mission-pet-state"],"section_id":"mission-pet-state"},{"label":"색상 변경에서 컴포넌트 재설계로","node_ids":["redesign-boundary"],"section_id":"redesign-boundary"},{"label":"원격 SQLite를 중간 운영안으로 채택","node_ids":["operations-storage"],"section_id":"operations-storage"},{"label":"감정 신뢰도와 기간을 분리한 통계","node_ids":["statistics-model"],"section_id":"statistics-model"}],"flows":[{"from":"common-product-boundary","id":"flow-01","label":"다음 판단","to":"identity-and-session"},{"from":"identity-and-session","id":"flow-02","label":"다음 판단","to":"realtime-conversation"},{"from":"realtime-conversation","id":"flow-03","label":"다음 판단","to":"profile-evolution"},{"from":"profile-evolution","id":"flow-04","label":"다음 판단","to":"capsule-scheduling"},{"from":"capsule-scheduling","id":"flow-05","label":"다음 판단","to":"mission-pet-state"},{"from":"mission-pet-state","id":"flow-06","label":"다음 판단","to":"redesign-boundary"},{"from":"redesign-boundary","id":"flow-07","label":"다음 판단","to":"operations-storage"},{"from":"operations-storage","id":"flow-08","label":"다음 판단","to":"statistics-model"},{"from":"statistics-model","id":"flow-09","label":"구현으로 연결","to":"implementation-flow"},{"from":"implementation-flow","id":"flow-10","label":"검증","to":"validation"},{"from":"validation","id":"flow-11","label":"현재 결과","to":"limitations"}],"nodes":[{"description":"기존 감정 기록 경험을 Todack으로 이어받되 별도 앱들의 느슨한 묶음으로 만들지 않았다. 웹, 데스크톱 위젯과 Expo 모바일이 공통 Web API를 사용하고 감정 기록과 대화, 프로필을 서버의 사용자 경계 안에서 읽는다. 클라이언트별 저장소를 두면 오프라인은 단순해지지만 어느 기록이 최신인지와 채널 간 기억 연속성을 설명하기 어려워진다.","id":"common-product-boundary","kind":"guardrail","label":"후속 기능을 하나의 제품과 원장으로 통합"},{"description":"초기 익명 또는 공유 저장 방식보다 사용자별 데이터 분리를 우선해 Google OAuth와 서버 세션을 중심으로 인증을 단순화했다. 브라우저는 쿠키 흐름을 사용할 수 있지만 네이티브 모바일은 같은 방식에 기대기 어려워, 명시적인 세션 헤더를 API 계약으로 사용한다.","id":"identity-and-session","kind":"guardrail","label":"사용자 경계와 모바일 세션 전달"},{"description":"텍스트 채팅과 실시간 음성을 서로 다른 인격으로 운영하지 않고 같은 사용자 기억과 개인화 프로필 경로에 연결했다. 채널이 달라졌다는 이유로 말투와 사용자 맥락이 갈라지는 문제를 줄이기 위한 선택이다. 실시간 음성에서는 마이크 mute와 hold를 이용해 스피커 출력이 다시 입력으로 들어가는 상황을 줄였다.","id":"realtime-conversation","kind":"process","label":"음성과 텍스트가 같은 기억을 사용"},{"description":"프롬프트를 서버 코드 안에 고정하지 않고 런타임 파일로 분리했다. 신규 사용자는 특정 개인의 성향을 물려받지 않는 일반형 프로필에서 시작하고, 사용자별 프로필은 각자의 데이터에 저장한다. 다른 서비스의 대화 기록을 직접 가져오는 방식도 택하지 않고 사용자가 내보낸 데이터나 직접 제공한 정보로 제한했다. 복잡한 내부 식별 입력 UI는 이후 숨겼다.","id":"profile-evolution","kind":"guardrail","label":"개인화 프롬프트와 프로필 변화 제어"},{"description":"미래 캡슐은 수동 전달 API로 가장 작은 흐름을 먼저 만든 뒤 due 항목을 자동 전달하는 방식으로 확장했다. 예약 시각은 UTC로 저장하고 사용자에게 보여 줄 때 각자의 시간대로 변환한다. 서버가 실행되는 지역시간을 그대로 저장하는 대안은 이동과 배포 환경이 바뀔 때 오동작하기 쉬워 제외했다.","id":"capsule-scheduling","kind":"service","label":"미래 캡슐의 예약과 공유 재정렬"},{"description":"미션과 펫 진행을 브라우저에만 저장하지 않고 서버의 사용자 상태로 관리한다. 일일 보상은 같은 요청이 반복돼도 한 번만 반영되도록 멱등 처리해 새로고침이나 네트워크 재시도로 점수가 중복되지 않게 했다.","id":"mission-pet-state","kind":"service","label":"미션과 보상의 중복 방지"},{"description":"첫 리디자인은 정보 구조와 기능을 고정하고 표면 스타일만 바꾸려 했다. 그러나 색만 달라지고 사용 흐름이 그대로라는 피드백을 받아 카드와 입력, 탐색 컴포넌트의 형태까지 수정 범위를 넓혔다. 기능을 유지한다는 말이 시각 token만 바꾸라는 뜻은 아니라는 요구 변경이었다.","id":"redesign-boundary","kind":"process","label":"색상 변경에서 컴포넌트 재설계로"},{"description":"현재 운영 저장소는 영속 볼륨을 붙인 SQLite를 전제로 한다. 초기 규모에서 배포와 백업 구조를 단순하게 유지할 수 있지만 단일 인스턴스 쓰기 경계와 장애 복구에 의존한다. 다중 인스턴스와 높은 동시성을 위한 PostgreSQL 전환은 후속 단계로 남겼다.","id":"operations-storage","kind":"guardrail","label":"원격 SQLite를 중간 운영안으로 채택"},{"description":"감정 카드, 코멘트와 대화는 같은 강도의 관측이 아니다. 통계 설계는 입력 채널별 신뢰도를 구분하고 7일, 28일, 84일 창에서 척도와 데이터 개수 조합을 나눠 본다. 평균 하나로 상태를 결론 내리거나 표본이 적은 장기 추세를 확정적으로 말하는 방식을 피했다.","id":"statistics-model","kind":"guardrail","label":"감정 신뢰도와 기간을 분리한 통계"},{"description":"Python API가 인증, 사용자별 SQLite, 프롬프트, 대화, 프로필, 캡슐, 미션, 펫과 실시간 세션을 집중 소유한다. 웹, Tk 위젯과 Expo 모바일은 같은 API를 호출하되 각 환경에 맞는 세션 전달과 화면 상태를 사용한다. 모바일 알림은 로컬 예약이고 장기 사용자 데이터는 서버가 맡는다.","id":"implementation-flow","kind":"process","label":"클라이언트와 서버의 구현 경계"},{"description":"현재 Python 서버와 데스크톱 위젯은 문법 검사를 통과했다. 통계 fixture도 제공된 매핑 안에서는 180개가 일치했다. 그러나 루트 전체를 보호하는 일관된 자동 테스트 게이트가 없고, 큰 dirty 작업 디렉터리의 모든 기능을 다시 실행하지 않았다.","id":"validation","kind":"guardrail","label":"문법 확인과 제품 품질의 차이"},{"description":"원격 SQLite는 단일 인스턴스 전제가 강하고, 서버 기능이 한 모듈에 집중돼 있다. 실시간 음성, 모바일 알림과 시간대 처리는 실제 기기에서 끝까지 검증되지 않았다. 결제 활성 상태도 코드만으로 확정할 수 없다.","id":"limitations","kind":"output","label":"운영과 안전에 남은 경계"}],"project_id":"todack","summary":"감정 기록과 대화에서 출발해 웹, 데스크톱 위젯과 모바일이 같은 사용자 데이터와 개인화 경로를 사용하도록 확장한 선택, 롤백과 아직 검증되지 않은 운영 경계를 정리한다.","title":"여러 화면에 감정 기록을 잇는 Todack: 구조와 결정 흐름"}
