{"decision_links":[{"label":"canonical profile과 tool adapter를 분리","node_ids":["canonical-profile-adapters"],"section_id":"canonical-profile-adapters"},{"label":"메모리 인프라와 프롬프트 상품을 분리","node_ids":["split-memory-product"],"section_id":"split-memory-product"},{"label":"runtime skill과 공유용 설명 문서를 분리","node_ids":["runtime-shareable-skills"],"section_id":"runtime-shareable-skills"},{"label":"watcher가 아닌 one-shot sync를 채택","node_ids":["one-shot-sync"],"section_id":"one-shot-sync"},{"label":"프로젝트에는 전체 복제 대신 얇은 링크를 두려 함","node_ids":["thin-project-link"],"section_id":"thin-project-link"},{"label":"결제 전에 로그인과 allowlist로 접근 제어","node_ids":["catalog-access"],"section_id":"catalog-access"},{"label":"자동 메모리와 workspace 기록의 소유권 재분리","node_ids":["ownership-replacement"],"section_id":"ownership-replacement"}],"flows":[{"from":"canonical-profile-adapters","id":"flow-01","label":"다음 판단","to":"split-memory-product"},{"from":"split-memory-product","id":"flow-02","label":"다음 판단","to":"runtime-shareable-skills"},{"from":"runtime-shareable-skills","id":"flow-03","label":"다음 판단","to":"one-shot-sync"},{"from":"one-shot-sync","id":"flow-04","label":"다음 판단","to":"thin-project-link"},{"from":"thin-project-link","id":"flow-05","label":"다음 판단","to":"catalog-access"},{"from":"catalog-access","id":"flow-06","label":"다음 판단","to":"ownership-replacement"},{"from":"ownership-replacement","id":"flow-07","label":"구현으로 연결","to":"implementation-flow"},{"from":"implementation-flow","id":"flow-08","label":"검증","to":"deployment-history"},{"from":"deployment-history","id":"flow-09","label":"검증","to":"failed-wiring"},{"from":"failed-wiring","id":"flow-10","label":"현재 결과","to":"current-status"}],"nodes":[{"description":"사용자·업무 정보를 `memory_profile.json`에 두고, source-of-truth Markdown과 AGENTS·CLAUDE·GEMINI·에디터용 adapter를 생성하도록 했다. 도구별 파일을 정본으로 직접 수정하는 대신 같은 shared text를 template에 삽입한다.","id":"canonical-profile-adapters","kind":"guardrail","label":"canonical profile과 tool adapter를 분리"},{"description":"`central_memory`, template, sync script와 schema는 메모리 인프라 계층으로 두고, owner profile·skill profile·company model·project rule·worklog prompt는 재사용 가능한 상품 계층으로 분리했다. 같은 주제를 다루더라도 하나는 실제 파일을 생성하고 다른 하나는 다른 팀이 자기 문서로 바꾸는 설계 안내다.","id":"split-memory-product","kind":"guardrail","label":"메모리 인프라와 프롬프트 상품을 분리"},{"description":"실행 중 모델이 따라야 하는 `SKILL.md`와 사람이 읽는 `skill_docs`를 같은 문서로 취급하지 않았다. runtime 원문은 정확한 trigger와 절차를 담고, 공유용 문서는 역할과 활용 방법을 설명한다.","id":"runtime-shareable-skills","kind":"guardrail","label":"runtime skill과 공유용 설명 문서를 분리"},{"description":"sync 스크립트는 실행할 때 profile을 읽어 source-of-truth와 adapter, memory index를 생성한다. 파일 변경 watcher나 Codex 세션 hook은 없고, 다음 대화에서 자동 실행되는 코드도 없다. “중앙 메모리”라는 이름과 달리 runtime 자동 갱신 장치는 아니었다.","id":"one-shot-sync","kind":"state","label":"watcher가 아닌 one-shot sync를 채택"},{"description":"각 프로젝트에 중앙 메모리 전체를 복사하지 않고 정본, short·mid·long-term layer와 log 위치를 가리키는 link 문서를 두도록 설계했다. 프로젝트별 규칙은 최소 차이만 갖고 공통 프로필은 중앙에서 읽게 하려는 방향이었다.","id":"thin-project-link","kind":"state","label":"프로젝트에는 전체 복제 대신 얇은 링크를 두려 함"},{"description":"웹 카탈로그는 prompt와 운영 문서를 목록으로 보여 주고, 상세 본문은 Google 로그인 후 관리자·구매자 이메일 allowlist에 포함된 계정만 열도록 했다. 복잡한 결제를 먼저 만들지 않고 콘텐츠 구조와 접근 경계를 확인하는 얇은 판매 실험이었다.","id":"catalog-access","kind":"guardrail","label":"결제 전에 로그인과 allowlist로 접근 제어"},{"description":"초기 키트는 사용자 프로필, 작업 layer와 프로젝트 link를 하나의 `central_memory` 아래에 모으려 했다. 하지만 현재 남은 link는 이동 전 위치를 가리키고, 이 프로젝트의 one-shot 생성물만으로 다른 세션의 자동 메모리 소유권을 주장할 수 없다.","id":"ownership-replacement","kind":"guardrail","label":"자동 메모리와 workspace 기록의 소유권 재분리"},{"description":"Python sync는 JSON profile을 읽어 shared Markdown을 만들고 다섯 종류 adapter와 index를 쓴다. Next.js 앱은 고정 catalog에서 Markdown source를 읽어 목록·상세 화면을 만들며, NextAuth Google provider가 로그인과 viewer 권한을 session에 넣는다.","id":"implementation-flow","kind":"process","label":"profile 생성과 카탈로그 구현"},{"description":"manager log에는 `npm run build`, Railway 프로젝트 초기화와 첫 업로드, 도메인 발급 기록이 있다. 동시에 Google OAuth는 콘솔과 배포 도메인 설정이 필요했고, Railway 변수 입력은 DNS 오류로 완료되지 않았다고 적혀 있다.","id":"deployment-history","kind":"guardrail","label":"과거 build와 미완료 운영 설정"},{"description":"자동화가 실패한 핵심은 central이라는 이름이 아니라 trigger 부재다. sync는 수동 실행형이고 project link는 오래된 절대 경로를 가지며, schema도 실행 중 검증되지 않는다. 세션이 시작될 때 읽는 hook과 파일 변경 때 갱신하는 watcher, 실패 시 알림이 없었다.","id":"failed-wiring","kind":"guardrail","label":"자동 갱신으로 동작하지 않은 이유"},{"description":"현재 이 프로젝트는 초기 중앙 메모리와 prompt vault의 역사 자산이다. one-shot 생성 코드와 adapter 산출물, 프롬프트 카탈로그 및 과거 build는 남아 있지만 자동 세션 wiring, 유효한 project link, OAuth 운영과 결제는 완료되지 않았다.","id":"current-status","kind":"output","label":"legacy 상태와 남은 가치"}],"project_id":"260324-central-memory-prompt-kit","summary":"사용자·업무 규칙을 한 원본에서 여러 AI 도구용 문서로 내보내고 프롬프트 카탈로그로 확장하려 했던 설계, 실제 one-shot 동기화 범위와 현재 대체 구조를 구분해 정리한다.","title":"중앙 메모리 원본과 도구별 어댑터 분리: 구조와 결정 흐름"}
