{"decision_links":[{"label":"feature flag와 응답 계약 보존","node_ids":["flag-and-envelope"],"section_id":"flag-and-envelope"},{"label":"depth 전달과 미구현 re-entry 경계","node_ids":["bounded-delegation"],"section_id":"bounded-delegation"},{"label":"family별 모듈과 실제 backend 경계","node_ids":["family-agents"],"section_id":"family-agents"},{"label":"준비된 질문과 자유 질의 분리","node_ids":["dqr-frg-bridge"],"section_id":"dqr-frg-bridge"},{"label":"action과 schedule 실행 소유권 유보","node_ids":["odl-schedule"],"section_id":"odl-schedule"},{"label":"proactive 흐름을 reactive router와 분리","node_ids":["proactive-contract"],"section_id":"proactive-contract"},{"label":"registry 전체 대신 compact context","node_ids":["prompt-context"],"section_id":"prompt-context"}],"flows":[{"from":"flag-and-envelope","id":"flow-01","label":"다음 판단","to":"bounded-delegation"},{"from":"bounded-delegation","id":"flow-02","label":"다음 판단","to":"family-agents"},{"from":"family-agents","id":"flow-03","label":"다음 판단","to":"dqr-frg-bridge"},{"from":"dqr-frg-bridge","id":"flow-04","label":"다음 판단","to":"odl-schedule"},{"from":"odl-schedule","id":"flow-05","label":"다음 판단","to":"proactive-contract"},{"from":"proactive-contract","id":"flow-06","label":"다음 판단","to":"prompt-context"},{"from":"prompt-context","id":"flow-07","label":"검증","to":"validation"},{"from":"validation","id":"flow-08","label":"현재 결과","to":"limitations"}],"nodes":[{"description":"약관 동의 조건을 먼저 확인한 뒤 flag가 켜져 있으면 A2A, 꺼져 있으면 기존 full_rag를 호출한다. 두 경로는 기존 클라이언트가 받는 응답 envelope를 유지한다.","id":"flag-and-envelope","kind":"service","label":"feature flag와 응답 계약 보존"},{"description":"현재 runtime은 route 진입에서 depth 1을 사용하고 family agent 호출에 depth 2를 전달한다. 그러나 depth 3 초과를 차단하는 guard는 구현돼 있지 않다.","id":"bounded-delegation","kind":"guardrail","label":"depth 전달과 미구현 re-entry 경계"},{"description":"DEF, DQR, FRG, ODL, SCH와 unsupported를 별도 모듈로 나눴다. 그러나 모듈이 있다는 사실과 production backend를 소유한다는 사실은 다르다.","id":"family-agents","kind":"guardrail","label":"family별 모듈과 실제 backend 경계"},{"description":"DQR은 사전에 준비된 질의만 안정적으로 연결하고 그 밖은 지원 불가로 처리한다. 자유 질의는 FRG가 기존 full_rag를 재사용해 현재 동작을 보존한다.","id":"dqr-frg-bridge","kind":"guardrail","label":"준비된 질문과 자유 질의 분리"},{"description":"ODL은 case 기반 legacy handoff까지만 제공하고 구조화 기기 backend를 직접 실행하지 않는다. SCH도 필요한 slot과 계획을 만들지만 schedule 실행은 별도 backend gate로 남긴다.","id":"odl-schedule","kind":"guardrail","label":"action과 schedule 실행 소유권 유보"},{"description":"proactive candidate와 arbiter는 사용자의 즉시 요청을 처리하는 reactive router와 다른 계약으로 유지한다. 후보 생성, 중재와 발송 조건이 일반 질의 routing에 섞이지 않게 한 것이다.","id":"proactive-contract","kind":"guardrail","label":"proactive 흐름을 reactive router와 분리"},{"description":"raw capability registry 전체를 planner에 넣는 대신 현재 발화와 관련된 capability와 route 경계만 담은 compact context를 사용한다.","id":"prompt-context","kind":"guardrail","label":"registry 전체 대신 compact context"},{"description":"flag, 약관, wrapper와 오류 응답은 주로 stub과 mock 테스트로 확인됐다. 문법과 JSON 구조 검사는 구현 연결성을 보여주지만 live planner, production DQR·ODL·schedule backend를 증명하지 않는다.","id":"validation","kind":"guardrail","label":"현재 검증이 증명하는 범위"},{"description":"Lambda A2A end-to-end, live planner, production FRG prompt와 실제 action backend는 미검증이다. true planner re-entry와 cycle/depth guard도 아직 구현되지 않았다. 현재 코드는 점진 전환 bridge와 agent 경계를 구현한 상태다.","id":"limitations","kind":"output","label":"production 전환에 남은 항목"}],"project_id":"a2a-lambda","summary":"기존 full_rag 계약을 feature flag 뒤에 보존하면서 family agent와 현재 delegation 경계를 도입한 bridge 구현 및 production 미완료 상태를 정리한다.","title":"Lambda A2A 점진 전환 구조: 구조와 결정 흐름"}
