{"decision_links":[{"label":"엔티티와 액션을 별도 축으로 분리","node_ids":["entity-action-split"],"section_id":"entity-action-split"},{"label":"순수 규칙 태깅을 Kiwi 기반으로 교체","node_ids":["replace-rule-retagging"],"section_id":"replace-rule-retagging"},{"label":"어근·어미·표면형을 함께 보존","node_ids":["preserve-action-parts"],"section_id":"preserve-action-parts"},{"label":"동작을 열 가지 의미 유형으로 분류","node_ids":["action-type-contract"],"section_id":"action-type-contract"},{"label":"말뭉치 확장을 단계별 파이프라인으로 분리","node_ids":["staged-corpus-pipeline"],"section_id":"staged-corpus-pipeline"},{"label":"학습 데이터와 사전 평가의 소유권 분리","node_ids":["split-asset-ownership"],"section_id":"split-asset-ownership"}],"flows":[{"from":"entity-action-split","id":"flow-01","label":"다음 판단","to":"replace-rule-retagging"},{"from":"replace-rule-retagging","id":"flow-02","label":"다음 판단","to":"preserve-action-parts"},{"from":"preserve-action-parts","id":"flow-03","label":"다음 판단","to":"action-type-contract"},{"from":"action-type-contract","id":"flow-04","label":"다음 판단","to":"staged-corpus-pipeline"},{"from":"staged-corpus-pipeline","id":"flow-05","label":"다음 판단","to":"split-asset-ownership"},{"from":"split-asset-ownership","id":"flow-06","label":"구현으로 연결","to":"implementation-flow"},{"from":"implementation-flow","id":"flow-07","label":"검증","to":"validation-boundary"},{"from":"validation-boundary","id":"flow-08","label":"현재 결과","to":"current-status"}],"nodes":[{"description":"첫 결정은 발화를 하나의 키워드 묶음으로 다루지 않는 것이었다. 무엇을 제어하는지 나타내는 엔티티와 무엇을 하려는지 나타내는 액션을 별도 열로 분리했다. 이 구조는 같은 대상에 실행·조회·조절이 붙는 경우와 같은 동작이 여러 대상에 쓰이는 경우를 구분하게 한다.","id":"entity-action-split","kind":"guardrail","label":"엔티티와 액션을 별도 축으로 분리"},{"description":"초기 규칙 태깅은 빠르게 표를 채울 수 있었지만, 활용형과 문맥을 과도하게 정규화하는 문제가 있었다. 로컬 작업에서는 기존 결과를 되돌릴 수 있게 보존한 뒤 Kiwi 형태소 분석으로 재태깅하는 방향으로 전환했다. 명사·동사 품사와 기능명 seed를 함께 보고, 일반 명사와 범용 동사는 별도 stop 목록으로 걸렀다.","id":"replace-rule-retagging","kind":"state","label":"순수 규칙 태깅을 Kiwi 기반으로 교체"},{"description":"액션은 정규화된 어근만 저장하지 않았다. 활용 어미와 사용자가 실제로 말한 표면형도 별도 값으로 남겼다. 예를 들어 같은 켜기 의도라도 명령형, 부탁형, 구어체가 다르며, 이 차이는 사전 확장과 오인식 대응에서 중요한 근거가 된다.","id":"preserve-action-parts","kind":"state","label":"어근·어미·표면형을 함께 보존"},{"description":"액션 스키마는 실행, 수준 조절, 토글, 모드 선택, 상태 조회, 정보 질문, 예약, 권한, 취소, 선호 설정의 열 가지 유형을 정의한다. 단순히 동사 표면형이 같은지를 보는 대신 제품이 수행해야 할 행동의 성격을 구분하기 위한 계약이다.","id":"action-type-contract","kind":"state","label":"동작을 열 가지 의미 유형으로 분류"},{"description":"대규모 말뭉치에서 바로 기능 후보를 확정하지 않고, 문서를 chunk로 나누고 동사 lemma 빈도를 집계한 뒤 기능 후보를 만들고 병합·의미 필터링하는 단계로 분리했다. 동사 inventory는 Kiwi 결과 중 동사·형용사 계열 lemma를 세어 JSON과 TSV로 내보낸다.","id":"staged-corpus-pipeline","kind":"guardrail","label":"말뭉치 확장을 단계별 파이프라인으로 분리"},{"description":"프로젝트가 커지면서 동사 학습 스크립트, active dictionary, 리플레이 결과가 한 폴더에서 서로의 완료 상태를 가렸다. 2026년 4월 정리에서는 사전 JSON과 리플레이 평가를 Dictionary Transition Bundle로 옮기고, 이 저장소에는 동사 기반 학습과 평가의 시작점만 남겼다.","id":"split-asset-ownership","kind":"guardrail","label":"학습 데이터와 사전 평가의 소유권 분리"},{"description":"재태깅 스크립트는 학습 workbook을 읽고 기능명에서 seed를 만들며, 각 발화를 Kiwi로 분석해 엔티티와 액션 부분을 기록한다. 별도 inventory 스크립트는 말뭉치에서 VV·VA·VX 계열 lemma 빈도를 계산한다. 이후 후보 확장, 병합, 의미 필터 단계가 기능별 후보를 좁히도록 구성됐다.","id":"implementation-flow","kind":"process","label":"재태깅과 후보 생성의 구현 흐름"},{"description":"현재 확인 가능한 것은 action type 스키마, Kiwi 재태깅 코드, 동사 inventory와 후보 처리 스크립트가 존재한다는 사실이다. 재태깅 구현은 workbook의 entity, 어근, 어미와 표면형을 다시 쓰지만, 저장소에는 이를 보호하는 독립 테스트 스위트가 없다.","id":"validation-boundary","kind":"guardrail","label":"과거 점검과 현재 재현성의 경계"},{"description":"이 프로젝트는 한국어 명령을 엔티티와 액션으로 분해하고 활용 정보를 보존하는 방법론과 구현 자산을 남겼다. 반면 비어 있는 token schema, 누락된 의존 모듈, 테스트 부재 때문에 저장소 하나만 받아 전체 과정을 재현할 수 있는 상태는 아니다.","id":"current-status","kind":"output","label":"현재 상태와 남은 작업"}],"project_id":"semantic-verb-schema","summary":"규칙으로 빈칸을 채우는 방식에서 벗어나 한국어 명령을 엔티티와 액션으로 분해하고, 형태소·활용형 정보를 후속 사전과 학습에서 다시 쓸 수 있게 보존한 과정을 정리한다.","title":"한국어 명령의 동사 의미 스키마 재구성: 구조와 결정 흐름"}
