{"decision_links":[{"label":"브라우저 저장소 대신 공통 원장 채택","node_ids":["shared-ledger"],"section_id":"shared-ledger"},{"label":"단일 클릭과 대화 시작을 분리","node_ids":["click-intent"],"section_id":"click-intent"},{"label":"누락 알림을 최근 일주일로 제한","node_ids":["reminder-window"],"section_id":"reminder-window"},{"label":"선택적 대화와 로컬 안전망","node_ids":["conversation-fallback"],"section_id":"conversation-fallback"},{"label":"화면에서 사라지지 않는 위젯","node_ids":["widget-visibility"],"section_id":"widget-visibility"},{"label":"인사이트와 과금의 순서","node_ids":["product-expansion"],"section_id":"product-expansion"}],"flows":[{"from":"shared-ledger","id":"flow-01","label":"다음 판단","to":"click-intent"},{"from":"click-intent","id":"flow-02","label":"다음 판단","to":"reminder-window"},{"from":"reminder-window","id":"flow-03","label":"다음 판단","to":"conversation-fallback"},{"from":"conversation-fallback","id":"flow-04","label":"다음 판단","to":"widget-visibility"},{"from":"widget-visibility","id":"flow-05","label":"다음 판단","to":"product-expansion"},{"from":"product-expansion","id":"flow-06","label":"구현으로 연결","to":"implementation-flow"},{"from":"implementation-flow","id":"flow-07","label":"검증","to":"validation"},{"from":"validation","id":"flow-08","label":"현재 결과","to":"limitations"}],"nodes":[{"description":"웹과 위젯이 각자의 로컬 상태를 갖게 하면 같은 날의 감정이 서로 다르게 보이고, 어느 쪽이 최신인지 설명하기 어렵다. 그래서 Python API가 SQLite를 소유하고 두 클라이언트가 같은 기록 API를 호출하도록 했다. 브라우저 저장소는 화면 보조 상태에만 쓰고 감정 기록과 대화 데이터의 정본으로 삼지 않았다.","id":"shared-ledger","kind":"service","label":"브라우저 저장소 대신 공통 원장 채택"},{"description":"위젯의 단일 클릭과 더블 클릭이 동시에 처리되면 기록 창과 대화 창이 연달아 열리고, 클릭할 때마다 새 창이 늘어날 수 있었다. 입력을 즉시 실행하는 대신 짧게 지연한 뒤 더블 클릭이 확인되면 단일 클릭 동작을 취소하는 방식으로 바꿨다. 팝업도 새 인스턴스를 계속 만들지 않고 기존 창을 다시 앞에 보낸다.","id":"click-intent","kind":"guardrail","label":"단일 클릭과 대화 시작을 분리"},{"description":"오랫동안 기록하지 않은 모든 날짜를 한꺼번에 보여 주면 회고를 돕기보다 밀린 숙제처럼 느껴질 수 있다. 누락 안내는 최근 7일로 한정해 복구 가능한 짧은 공백만 보여 주도록 했다. 장기 공백 전체를 채우게 만드는 대안보다 다시 기록을 시작하는 부담을 낮추는 쪽을 선택했다.","id":"reminder-window","kind":"guardrail","label":"누락 알림을 최근 일주일로 제한"},{"description":"감정 기록 뒤의 대화는 외부 모델을 사용할 수 있을 때 더 다양한 응답을 만들지만, 외부 설정이나 네트워크가 없다는 이유로 기록과 기본 피드백까지 멈추게 하지 않았다. 서버는 규칙 기반 응답을 기본 안전망으로 두고 외부 호출이 실패하면 같은 경로에서 로컬 응답으로 돌아온다.","id":"conversation-fallback","kind":"guardrail","label":"선택적 대화와 로컬 안전망"},{"description":"WSL과 다중 화면 환경에서는 저장된 좌표가 현재 화면 바깥에 놓이거나 글꼴과 이모지 차이로 아이콘이 보이지 않는 문제가 있었다. 시작할 때 위치를 화면 경계 안으로 보정하고, 진단용 가시성 모드를 두며, 특정 글꼴에 의존하는 요소는 Canvas 도형으로 대체할 수 있게 했다.","id":"widget-visibility","kind":"guardrail","label":"화면에서 사라지지 않는 위젯"},{"description":"문서상 제품 확장은 규칙 기반 요약, 추세, 예측의 세 단계로 잡았다. 현재 구현이 규칙과 단순 추세 수준에 머문 상태에서 예측을 제공한다고 말하지 않으며, 사용자가 첫 유효 인사이트를 보기 전에 결제를 요구하는 흐름도 채택하지 않았다. 먼저 기록에서 얻는 가치를 확인한 뒤 유료 기능을 검토한다는 순서다.","id":"product-expansion","kind":"state","label":"인사이트와 과금의 순서"},{"description":"Python HTTP 서버가 감정 기록과 대화 API를 제공하고 SQLite에 저장한다. 정적 웹은 조회, 수정과 통계를 담당하며 Tk 위젯은 같은 API로 빠른 기록과 대화 팝업을 연다. 위젯 위치와 아이콘 상태 같은 화면 설정은 별도 로컬 설정에 보존된다.","id":"implementation-flow","kind":"process","label":"기록과 대화가 저장되는 구조"},{"description":"현재 분석에서는 Python 서버와 위젯, 브라우저 스크립트의 문법을 확인했다. 과거 작업 기록에는 구조화 응답의 필드와 응답 출처 확인, 위젯 창 충돌과 위치 보정 수정이 남아 있다. 자동 회귀 테스트 묶음은 없어 문법 통과를 제품 동작 전체의 검증으로 볼 수 없다.","id":"validation","kind":"guardrail","label":"확인한 동작과 확인하지 못한 화면"},{"description":"SQLite는 단일 사용자 로컬 사용을 전제로 하고 동시 쓰기와 복구 정책이 충분히 다듬어지지 않았다. 모바일, 계정 동기화, 백업과 다중 사용자 경계도 없다. 감정 분류는 전문 평가가 아니라 단순한 제품 로직이며, 위기 도움 연결을 제공하지 않는다.","id":"limitations","kind":"output","label":"초기 제품에 남은 한계"}],"project_id":"260212-feeling-traker","summary":"빠른 입력은 데스크톱 위젯에, 관리와 통계는 웹에 맡기고 하나의 SQLite 원장으로 기록과 대화를 연결한 초기 감정 기록 제품의 결정과 한계를 정리한다.","title":"웹과 위젯을 잇는 감정 기록 도구: 구조와 결정 흐름"}
