{"decision_links":[{"label":"TMAP 계획과 VWorld 확정의 역할 분리","node_ids":["provider-role-boundary"],"section_id":"provider-role-boundary"},{"label":"외부 API를 서버 프록시 뒤에 배치","node_ids":["provider-adapter-proxy"],"section_id":"provider-adapter-proxy"},{"label":"GPS 주행 설계에서 static preview로 범위 축소","node_ids":["scope-rollback-static-preview"],"section_id":"scope-rollback-static-preview"},{"label":"계획 경로를 별도 preview 상태로 유지","node_ids":["separate-preview-state"],"section_id":"separate-preview-state"},{"label":"설계한 데이터 수명과 현재 저장 계약의 충돌","node_ids":["unresolved-data-lifetime"],"section_id":"unresolved-data-lifetime"},{"label":"사용자 경유 pin과 내부 guidance point 분리","node_ids":["visible-pin-hidden-guidance"],"section_id":"visible-pin-hidden-guidance"},{"label":"도로 기록을 route group과 trip과 spot으로 확장","node_ids":["route-trip-spot-flow"],"section_id":"route-trip-spot-flow"}],"flows":[{"from":"provider-role-boundary","id":"flow-01","label":"다음 판단","to":"provider-adapter-proxy"},{"from":"provider-adapter-proxy","id":"flow-02","label":"다음 판단","to":"scope-rollback-static-preview"},{"from":"scope-rollback-static-preview","id":"flow-03","label":"다음 판단","to":"separate-preview-state"},{"from":"separate-preview-state","id":"flow-04","label":"다음 판단","to":"unresolved-data-lifetime"},{"from":"unresolved-data-lifetime","id":"flow-05","label":"다음 판단","to":"visible-pin-hidden-guidance"},{"from":"visible-pin-hidden-guidance","id":"flow-06","label":"다음 판단","to":"route-trip-spot-flow"},{"from":"route-trip-spot-flow","id":"flow-07","label":"구현으로 연결","to":"implementation-flow"},{"from":"implementation-flow","id":"flow-08","label":"검증","to":"validation"},{"from":"validation","id":"flow-09","label":"현재 결과","to":"limitations"}],"nodes":[{"description":"장소 검색과 예상 자동차 경로는 TMAP이 맡고, 영구 방문선은 VWorld 도로 Feature를 확인한 뒤에만 만들도록 설계했다. 계획 단계에서는 빠르게 후보를 받고 수정할 수 있어야 하지만, 기록 단계에서는 어떤 원본 도로를 저장했는지 추적할 수 있어야 했기 때문이다.","id":"provider-role-boundary","kind":"guardrail","label":"TMAP 계획과 VWorld 확정의 역할 분리"},{"description":"브라우저가 외부 API의 인증 정보와 원본 응답 형식을 직접 소유하지 않도록 Node 서버에 POI와 자동차 경로 endpoint를 두었다. 서버는 요청을 검증하고 TMAP 응답을 화면에 필요한 spot, path, 거리, 시간 형태로 정규화한다. VWorld 조회도 같은 서버 경계를 지나 앱이 일정한 Feature 형태를 받는다.","id":"provider-adapter-proxy","kind":"guardrail","label":"외부 API를 서버 프록시 뒤에 배치"},{"description":"초기 설계는 foreground GPS, 경로 이탈 감지, 재탐색, 주행 종료 후 VWorld match review까지 포함했다. 구현 단계에서는 장소 검색, 출발·도착 선택, 예상 경로 표시와 수정에 집중하는 static preview로 범위를 줄였다. 백그라운드 수명과 실제 주행 정합성을 해결하지 않은 채 GPS 기능을 넓히는 것보다 계획 경로의 의미를 먼저 검증하는 편이 안전하다고 봤다.","id":"scope-rollback-static-preview","kind":"guardrail","label":"GPS 주행 설계에서 static preview로 범위 축소"},{"description":"예상 경로는 검색 도로, 현재 선택, 저장 완료 도로와 다른 Leaflet layer와 state로 유지했다. 사용자가 파란 추천선을 보고 있어도 그것이 이미 방문한 길이나 저장 확정 후보처럼 보이지 않게 하기 위해서다.","id":"separate-preview-state","kind":"state","label":"계획 경로를 별도 preview 상태로 유지"},{"description":"설계 목표는 명확하다. 조사 기준의 TMAP API 약관은 API 데이터의 저장 후 24시간 이상 사용을 제한하므로 TMAP route geometry는 세션 입력으로만 두고, 사용자가 확정한 VWorld Feature ID와 geometry snapshot만 영구 저장해야 한다. 변환이 끝나면 TMAP 원본 route를 폐기하고, 장기 기록은 VWorld snapshot에서 다시 그려야 한다.","id":"unresolved-data-lifetime","kind":"guardrail","label":"설계한 데이터 수명과 현재 저장 계약의 충돌"},{"description":"경유지 수정은 사용자가 지도에서 보는 pin과 provider 요청을 안정화하는 내부 guidance point를 분리했다. 같은 고속도로 링크가 여러 조각으로 나타나거나 긴 구간에서 대표 좌표 하나만 보내면, provider가 의도와 다른 진입 방향을 선택할 수 있었기 때문이다.","id":"visible-pin-hidden-guidance","kind":"guardrail","label":"사용자 경유 pin과 내부 guidance point 분리"},{"description":"V2는 하나의 도로 record에 머물지 않고 여러 잘린 도로 구간을 route group으로 묶고, 여행과 장소 기록을 연결하는 모바일 흐름으로 확장했다. 휴게소나 주유소 같은 장소도 카테고리와 함께 저장해 도로선만으로 표현하기 어려운 여행 맥락을 남기려 했다.","id":"route-trip-spot-flow","kind":"state","label":"도로 기록을 route group과 trip과 spot으로 확장"},{"description":"사용자가 출발지, 도착지, 경유지를 고르면 브라우저는 서버 프록시를 통해 TMAP route 후보를 받고 별도 preview state에 표시한다. 수정 과정에서는 사용자 pin과 guidance point를 조합해 route를 다시 요청한다. 확정 단계에서는 route 주변 도로명을 바탕으로 VWorld Feature를 조회하고 각 Feature를 잘라 route segment 집합을 만든다.","id":"implementation-flow","kind":"process","label":"예상 경로에서 방문 record까지"},{"description":"현재 테스트 소스에는 domain 42개, build 1개, provider와 workflow 21개, server 25개로 총 89개 선언이 있다는 private 분석이 있다. 과거 로컬 세션에서는 npm check와 브라우저의 검색, 경로 표시, 수정, 저장 후보 흐름이 통과했다. 현재 테스트는 route group이 displayGeometry를 보존하는 것도 기대한다.","id":"validation","kind":"guardrail","label":"확인된 회귀와 실패한 계약"},{"description":"우선 routeGroup.displayGeometry를 영구 record에서 제거하거나 VWorld snapshot에서만 재구성해야 한다. 기존 localStorage 데이터에는 migration 또는 삭제 기준이 필요하고, preview, 검색 결과, spot 파생 필드에는 생성 시각과 만료 정책을 추가해야 한다.","id":"limitations","kind":"output","label":"다음 구현이 닫아야 할 경계"}],"project_id":"260802-map-diary-v2","summary":"TMAP 계획 데이터와 VWorld 영구 기록을 분리하려 한 설계, static preview로의 범위 조정, 그리고 현재 displayGeometry와 TTL 부재가 만든 핵심 미해결 계약을 정리한다.","title":"계획 경로와 방문 기록을 나누는 두 번째 실험: 구조와 결정 흐름"}
