{"decision_links":[{"label":"기술 정의보다 의사결정 맥락을 먼저 설명","node_ids":["why-first-structure"],"section_id":"why-first-structure"},{"label":"시스템 경계를 따라 10권으로 확장","node_ids":["ten-volume-boundary"],"section_id":"ten-volume-boundary"},{"label":"3,000쪽 목표와 현재 원고를 분리","node_ids":["separate-goal-progress"],"section_id":"separate-goal-progress"},{"label":"Markdown을 원본으로 정적 HTML 생성","node_ids":["markdown-canonical-source"],"section_id":"markdown-canonical-source"},{"label":"glossary와 본문을 분리한 검색","node_ids":["two-stage-search"],"section_id":"two-stage-search"},{"label":"실제 관찰과 미래 architecture 후보를 구분","node_ids":["separate-observation-proposal"],"section_id":"separate-observation-proposal"},{"label":"구현 단계보다 PM 질문을 학습 단위로 선택","node_ids":["decision-centered-lessons"],"section_id":"decision-centered-lessons"}],"flows":[{"from":"why-first-structure","id":"flow-01","label":"다음 판단","to":"ten-volume-boundary"},{"from":"ten-volume-boundary","id":"flow-02","label":"다음 판단","to":"separate-goal-progress"},{"from":"separate-goal-progress","id":"flow-03","label":"다음 판단","to":"markdown-canonical-source"},{"from":"markdown-canonical-source","id":"flow-04","label":"다음 판단","to":"two-stage-search"},{"from":"two-stage-search","id":"flow-05","label":"다음 판단","to":"separate-observation-proposal"},{"from":"separate-observation-proposal","id":"flow-06","label":"다음 판단","to":"decision-centered-lessons"},{"from":"decision-centered-lessons","id":"flow-07","label":"구현으로 연결","to":"implementation-flow"},{"from":"implementation-flow","id":"flow-08","label":"검증","to":"verified-assets"},{"from":"verified-assets","id":"flow-09","label":"현재 결과","to":"current-status"}],"nodes":[{"description":"각 장은 현실 상황과 문제, 비유, 기술 흐름, 실제 서비스, 장애 단서, 회의 질문을 하나의 학습 단위로 묶는다. 독자가 용어 정의를 외운 뒤 적용법을 찾는 대신, 어떤 문제가 기술을 만들었고 제품 결정에서 무엇이 달라지는지부터 읽게 했다.","id":"why-first-structure","kind":"process","label":"기술 정의보다 의사결정 맥락을 먼저 설명"},{"description":"커리큘럼은 인터넷·웹·앱·서버 연결에서 시작해 모바일 통신, 서버와 클라우드, AI·RAG·Agent, 트러블슈팅, 브라우저, 비동기·실시간, API·인증·보안, IoT·OTA, 관측과 운영으로 이어진다. 각 권은 기술 이름이 아니라 제품이 나뉘는 시스템 경계를 중심으로 구성됐다.","id":"ten-volume-boundary","kind":"guardrail","label":"시스템 경계를 따라 10권으로 확장"},{"description":"제작 계획은 약 3,000쪽의 8~10권 시리즈를 목표로 잡았지만 현재 원고가 완성 책이 아니라고 명시한다. 권별 파일이 모두 존재한다는 사실을 전권이 출판 분량으로 완성됐다는 주장으로 바꾸지 않았다.","id":"separate-goal-progress","kind":"guardrail","label":"3,000쪽 목표와 현재 원고를 분리"},{"description":"원고의 정본은 `book/` 아래 Markdown으로 두고 Python build가 목차, 이전·다음 이동과 navigation을 포함한 정적 HTML을 생성한다. 웹에서 직접 본문을 고치는 방식보다 변경 이력을 읽고 다른 출력 형식으로 옮기기 쉽다.","id":"markdown-canonical-source","kind":"interface","label":"Markdown을 원본으로 정적 HTML 생성"},{"description":"검색은 용어 정의와 책 본문을 같은 결과 목록에 섞지 않는다. glossary term과 alias, 짧은 정의, 생긴 이유를 먼저 점수화하고, 별도 영역에서 제목·소제목·본문을 검색한다. 정확히 일치하는 용어와 heading에 더 큰 가중치를 준다.","id":"two-stage-search","kind":"guardrail","label":"glossary와 본문을 분리한 검색"},{"description":"실무 사례는 현재 앱에서 확인한 동작과 향후 도입할 수 있는 cloud·streaming architecture를 같은 사실처럼 쓰지 않는다. 관찰된 요청·응답과 운영 경계를 먼저 적고, TURN, managed video, IAM 같은 구조는 검토 후보로 표시한다.","id":"separate-observation-proposal","kind":"guardrail","label":"실제 관찰과 미래 architecture 후보를 구분"},{"description":"같은 기술도 도입 여부보다 누가 권한을 발급하고, 어디에서 retry하며, 실패를 어떤 지표로 관측하는지가 제품 결과를 바꾼다. 각 장에는 “앱이 직접 권한을 갖는가”, “backend가 임시 권한을 발급하는가”, “명령 전송과 실제 기기 실행을 어떻게 구분하는가” 같은 질문을 넣었다.","id":"decision-centered-lessons","kind":"guardrail","label":"구현 단계보다 PM 질문을 학습 단위로 선택"},{"description":"`build_book_pages.py`는 고정된 Markdown 목록을 순회해 HTML을 만들고 각 페이지의 목차와 이전·다음 링크를 구성한다. `build_search_index.py`는 glossary seed와 Markdown heading·본문을 JavaScript index로 직렬화한다. 브라우저의 `search.js`는 query를 정규화하고 glossary와 본문을 별도 score로 정렬한다.","id":"implementation-flow","kind":"process","label":"원고에서 웹 문서와 검색 index까지"},{"description":"10권의 Markdown 파일과 roadmap, 제작 계획, glossary, 실무 사례가 존재하며, 대응하는 정적 HTML과 검색 index도 남아 있다. 생성 파일은 원고보다 늦은 시각을 가져 과거 build가 수행된 흔적으로 볼 수 있다.","id":"verified-assets","kind":"guardrail","label":"확인된 출판 자산"},{"description":"현재 결과는 10권 완간이 아니라 PM이 시스템 경계를 따라 배울 수 있는 커리큘럼, 원고 정본과 정적 출판·검색 파이프라인이다. 특히 why-first 장 구조와 1권의 연결 서사는 실제 독자 경험을 설명할 수 있는 기반이다.","id":"current-status","kind":"output","label":"출판 골격과 미완성 본문의 경계"}],"project_id":"260727-server-app-web-learn-book","summary":"용어 암기 대신 화면·API·서버·운영의 경계를 따라 판단하도록 10권 커리큘럼과 Markdown 기반 정적 출판·검색 구조를 만든 과정과 아직 채워야 할 본문 범위를 정리한다.","title":"비개발 PM을 위한 서비스 기술 학습서 설계: 구조와 결정 흐름"}
