{"decision_links":[{"label":"운영 데이터 정본을 세 영역으로 분리","node_ids":["source-separation"],"section_id":"source-separation"},{"label":"도구별 memory 파일을 파생물로 관리","node_ids":["adapter-generation"],"section_id":"adapter-generation"},{"label":"V1은 탐색과 운영 안정성 우선","node_ids":["v1-scope"],"section_id":"v1-scope"},{"label":"파일 session에서 signed cookie로 변경","node_ids":["auth-revision"],"section_id":"auth-revision"},{"label":"로그인, 사용량과 plan 분리","node_ids":["access-state"],"section_id":"access-state"},{"label":"provider 차이를 공통 prompt 기능 뒤로","node_ids":["provider-adapter"],"section_id":"provider-adapter"},{"label":"자동 갱신 실패를 manual review로 남김","node_ids":["registry-updater"],"section_id":"registry-updater"},{"label":"당시 adapter 원본과 현재 전역 memory 구분","node_ids":["memory-boundary"],"section_id":"memory-boundary"}],"flows":[{"from":"source-separation","id":"flow-01","label":"다음 판단","to":"adapter-generation"},{"from":"adapter-generation","id":"flow-02","label":"다음 판단","to":"v1-scope"},{"from":"v1-scope","id":"flow-03","label":"다음 판단","to":"auth-revision"},{"from":"auth-revision","id":"flow-04","label":"다음 판단","to":"access-state"},{"from":"access-state","id":"flow-05","label":"다음 판단","to":"provider-adapter"},{"from":"provider-adapter","id":"flow-06","label":"다음 판단","to":"registry-updater"},{"from":"registry-updater","id":"flow-07","label":"검증","to":"stale-registry"},{"from":"stale-registry","id":"flow-08","label":"다음 판단","to":"memory-boundary"},{"from":"memory-boundary","id":"flow-09","label":"현재 결과","to":"limitations"}],"nodes":[{"description":"모델과 도구 사실은 registry, 프로젝트 상태는 project registry, 공통 작업 방식은 normalized memory profile이 소유한다. 한 파일이 모든 사실을 중복 보관하지 않는다.","id":"source-separation","kind":"guardrail","label":"운영 데이터 정본을 세 영역으로 분리"},{"description":"AGENTS, Claude, Gemini, Cursor와 Windsurf용 파일을 각각 수기 수정하지 않고 normalized profile에서 생성한다. 설치 skill registry도 현재 scan 결과에서 파생한다.","id":"adapter-generation","kind":"state","label":"도구별 memory 파일을 파생물로 관리"},{"description":"초기 범위는 workflow builder와 복잡한 조직 협업보다 모델·도구 탐색, 로그인, 개인화와 prompt 재사용에 집중했다. 정적 HTML·CSS·JavaScript UI를 유지하고 서비스 호출만 Python server가 처리한다.","id":"v1-scope","kind":"service","label":"V1은 탐색과 운영 안정성 우선"},{"description":"서버 파일에 session 상태를 쌓는 방식에서 서명 cookie 기반 stateless session으로 교체했다. 배포 인스턴스와 로컬 파일 상태가 어긋나는 문제를 줄이고 인증 검증을 요청 경계로 옮겼다.","id":"auth-revision","kind":"guardrail","label":"파일 session에서 signed cookie로 변경"},{"description":"로그인 여부, 무료 사용량, 유료 plan과 prompt 실행 권한을 한 boolean으로 합치지 않는다. 사용자는 로그인했지만 quota가 없을 수 있고, plan이 있어도 provider 설정이 없을 수 있다.","id":"access-state","kind":"guardrail","label":"로그인, 사용량과 plan 분리"},{"description":"여러 provider의 요청 형식을 adapter로 감싸 Prompt Tailor와 Translate 같은 공통 기능에서 호출한다. provider 오류는 내부 예외나 비밀값 대신 일반화된 사용자 메시지로 바꾼다.","id":"provider-adapter","kind":"service","label":"provider 차이를 공통 prompt 기능 뒤로"},{"description":"updater는 일부 공식 source의 version 패턴을 확인하고 일치하면 상태를 갱신한다. source 실패나 불일치는 파일 전체를 조용히 성공시키지 않고 needs_manual_review로 남긴다.","id":"registry-updater","kind":"guardrail","label":"자동 갱신 실패를 manual review로 남김"},{"description":"현재 model/tool registry의 generated_at은 2026년 3월 19일이다. 현재 시점의 공식 정보로 다시 검증한 기록이 없으므로 최신 허브라는 기준을 통과하지 못한다.","id":"stale-registry","kind":"guardrail","label":"현재 registry는 오래된 상태"},{"description":"프로젝트 내부 normalized memory는 이 허브가 여러 도구 파일을 만드는 데 사용한 설계 자산이다. 현재 workspace의 user-wide memory를 덮어쓰거나 다음 Codex 대화에 자동 적용하지 않는다.","id":"memory-boundary","kind":"state","label":"당시 adapter 원본과 현재 전역 memory 구분"},{"description":"registry currentness, 프로젝트 목록 동기화, 인증·quota·provider 회귀 테스트와 public deployment를 다시 확인해야 한다. package script에서 자동 테스트도 확인되지 않았다.","id":"limitations","kind":"output","label":"재가동 전에 필요한 점검"}],"project_id":"260319-llm-tool-hub","summary":"모델·도구·프로젝트 registry와 normalized memory를 분리하고 도구별 adapter를 생성한 허브의 구조, 인증 변경과 오래된 registry 한계를 정리한다.","title":"LLM 도구와 메모리 어댑터 운영 허브: 구조와 결정 흐름"}
