{"decision_links":[{"label":"PWA 대신 web-native 하이브리드 선택","node_ids":["hybrid-container"],"section_id":"hybrid-container"},{"label":"Native SQLite를 raw drive 정본으로 채택","node_ids":["native-sqlite-source"],"section_id":"native-sqlite-source"},{"label":"sequence cursor 기반 WebView 동기화","node_ids":["sequence-paging"],"section_id":"sequence-paging"},{"label":"저장 상태에 따라 24시간과 30일로 보존","node_ids":["state-based-retention"],"section_id":"state-based-retention"},{"label":"승인된 공공 도로 snapshot만 영구 저장","node_ids":["approved-snapshot-only"],"section_id":"approved-snapshot-only"},{"label":"TMAP을 gap 후보 생성으로 제한","node_ids":["tmap-candidate-only"],"section_id":"tmap-candidate-only"},{"label":"review mutation을 revision CAS로 보호","node_ids":["revision-cas"],"section_id":"revision-cas"},{"label":"분석과 provider 실패를 별도 상태로 보존","node_ids":["fail-closed-analysis"],"section_id":"fail-closed-analysis"},{"label":"기존 도로 연결 검증을 재사용한 수동확정","node_ids":["manual-gap-confirmation"],"section_id":"manual-gap-confirmation"},{"label":"자동 주행 감지를 opt-in review-only로 제한","node_ids":["opt-in-auto-detection"],"section_id":"opt-in-auto-detection"}],"flows":[{"from":"hybrid-container","id":"flow-01","label":"다음 판단","to":"native-sqlite-source"},{"from":"native-sqlite-source","id":"flow-02","label":"다음 판단","to":"sequence-paging"},{"from":"sequence-paging","id":"flow-03","label":"다음 판단","to":"state-based-retention"},{"from":"state-based-retention","id":"flow-04","label":"다음 판단","to":"approved-snapshot-only"},{"from":"approved-snapshot-only","id":"flow-05","label":"다음 판단","to":"tmap-candidate-only"},{"from":"tmap-candidate-only","id":"flow-06","label":"다음 판단","to":"revision-cas"},{"from":"revision-cas","id":"flow-07","label":"다음 판단","to":"fail-closed-analysis"},{"from":"fail-closed-analysis","id":"flow-08","label":"다음 판단","to":"manual-gap-confirmation"},{"from":"manual-gap-confirmation","id":"flow-09","label":"다음 판단","to":"opt-in-auto-detection"},{"from":"opt-in-auto-detection","id":"flow-10","label":"구현으로 연결","to":"implementation-flow"},{"from":"implementation-flow","id":"flow-11","label":"검증","to":"validation"},{"from":"validation","id":"flow-12","label":"현재 결과","to":"limitations"}],"nodes":[{"description":"기존 HTML, CSS, JavaScript 화면을 Capacitor iOS 컨테이너 안에 유지하고 Core Location과 저장소는 전용 Swift plugin으로 옮겼다. PWA 단독은 백그라운드 신뢰성이 부족했고, 전체 SwiftUI 재작성은 지도와 review 기능을 다시 만드는 비용과 회귀 범위가 컸다.","id":"hybrid-container","kind":"state","label":"PWA 대신 web-native 하이브리드 선택"},{"description":"위치 event를 곧바로 WebView 배열이나 localStorage에 넣지 않고 네이티브 SQLite에 먼저 기록한다. 세션, sequence가 있는 점, gap, review resolution을 관계형 테이블로 관리하며 foreign key, WAL, 직렬 queue와 transaction으로 부분 쓰기와 재실행 복구를 다룬다.","id":"native-sqlite-source","kind":"state","label":"Native SQLite를 raw drive 정본으로 채택"},{"description":"웹은 전체 GPS 배열을 매번 다시 받지 않는다. getDrivePoints에 afterSequence와 page limit을 넘기고, nextSequence와 hasMore를 따라 누락분을 순서대로 읽는다. 실시간 event는 화면 갱신 신호이며 실제 좌표의 정본은 SQLite 조회 결과다.","id":"sequence-paging","kind":"state","label":"sequence cursor 기반 WebView 동기화"},{"description":"초기 문서는 종료된 raw GPS를 마지막 좌표 기준 24시간 보관한다고 단순화했다. 최신 구현은 사용자가 영구 저장을 끝낸 saved 세션은 24시간 뒤 정리하지만, 아직 검토가 필요하거나 중단된 review와 interrupted 세션은 최대 30일 보관한다. 확정 작업 전에 원본과 resolution이 사라지는 것을 막기 위한 수정이다.","id":"state-based-retention","kind":"state","label":"저장 상태에 따라 24시간과 30일로 보존"},{"description":"raw GPS와 TMAP route를 영구 방문선으로 바꾸지 않고, strict normalization을 통과한 공공 도로 snapshot만 최종 record에 넣는다. 초기 설계는 VWorld만 언급했지만 최신 구현은 exact Feature ID와 provider 조합을 검사해 VWorld 도로명주소도로와 ITS link Feature를 승인한다.","id":"approved-snapshot-only","kind":"guardrail","label":"승인된 공공 도로 snapshot만 영구 저장"},{"description":"GPS가 끊긴 구간에서 TMAP은 두 endpoint 사이의 도로 후보를 찾는 입력으로 사용할 수 있지만 resolution이나 영구 payload에는 들어가지 않는다. 서버는 TMAP 경로를 VWorld/ITS link와 coverage, 방향, topology로 검증한 뒤 최대 세 개의 sanitized 후보만 돌려준다.","id":"tmap-candidate-only","kind":"guardrail","label":"TMAP을 gap 후보 생성으로 제한"},{"description":"후보 확정, 수동 연결, 저장 제외는 session ID와 span key, expectedRevision이 모두 일치할 때만 native SQLite에 반영한다. 새 resolution은 revision 0에서 시작하고, update와 delete는 현재 revision을 조건으로 실행한다. 영향 행이 없으면 최신 resolution과 revisionConflict를 반환한다.","id":"revision-cas","kind":"state","label":"review mutation을 revision CAS로 보호"},{"description":"일부 window만 성공하거나 provider가 timeout, rate limit, 인증 오류를 반환했을 때 빈 후보를 곧바로 \"도로 없음\"으로 해석하지 않는다. complete success가 없는 span은 needsRoadServer 상태로 남기고 임시 보관 또는 명시적 제외만 허용한다. truncated나 candidate cap, partial/error가 있으면 completeness를 false로 유지한다.","id":"fail-closed-analysis","kind":"guardrail","label":"분석과 provider 실패를 별도 상태로 보존"},{"description":"분석은 완전하게 끝났지만 후보가 0개인 closed gap을 needsManualJoin으로 분류한다. 사용자는 지도에서 진입과 이탈 endpoint를 순서대로 지정하고, 서버가 TMAP route를 VWorld/ITS 도로와 검증해 만든 후보를 preview로 확인한다. 후보가 하나여도 자동 분석이 해결하지 못한 구간이므로 \"이 경로로 잇기\" action을 명시적으로 눌러야 한다.","id":"manual-gap-confirmation","kind":"guardrail","label":"기존 도로 연결 검증을 재사용한 수동확정"},{"description":"자동 감지는 기본 OFF다. 사용자가 Always 위치, full accuracy, motion, 알림 권한을 허용한 경우에만 significant-change service로 저전력 대기한다. 이동 신호가 오면 최대 90초 동안 정상 좌표 3개 이상, 30초 이상, 150m 미만 실패와 200m 목표 이동, automotive motion을 결합해 정밀 recorder 시작 여부를 판단한다.","id":"opt-in-auto-detection","kind":"guardrail","label":"자동 주행 감지를 opt-in review-only로 제한"},{"description":"Core Location과 Motion이 native coordinator에 event를 보내면 recorder가 quality filter를 통과한 점을 SQLite transaction으로 저장한다. WebView는 sequence paging으로 세션, 점, gap과 resolution을 rehydrate하고 review analysis가 각 raw edge를 confirmed, needsRoadServer, needsManualJoin 또는 excluded 후보로 분류한다.","id":"implementation-flow","kind":"process","label":"기록에서 영구 도로 확정까지"},{"description":"release evidence에는 Node와 build 통합 433/433 PASS, focused Task 6 Playwright 13/13, 전체 브라우저 127/127과 후속 compact UI 128/128 결과가 기록돼 있다. manual join 분류, endpoint 선택, provider completeness, VWorld/ITS snapshot validation, revision CAS와 persistence 계약을 다루는 코드와 테스트도 존재한다.","id":"validation","kind":"guardrail","label":"로컬 통합 성공과 release gate의 분리"},{"description":"iPhone 실제 주행 감지율, 정지·실내·대중교통 오탐, sequence jump, 화면 잠금과 재부팅 복구, 접근성, 알림, 배터리 기준이 비어 있다. significant-change 감시는 출발 초반을 놓칠 수 있고 자동차 motion만으로 버스와 기차를 완전히 구분하지 못한다. force quit 뒤 자동 감지 재개도 보장하지 않는다.","id":"limitations","kind":"output","label":"아직 release-ready가 아닌 이유"}],"project_id":"260802-map-diary-v3","summary":"웹 UI의 반복 속도를 유지하면서 iOS 백그라운드 위치 수집과 SQLite 원본 보존을 네이티브가 소유하도록 바꾸고, 실패를 숨기지 않는 review workflow로 영구 기록을 확정한 과정이다.","title":"웹 지도와 네이티브 주행 기록의 경계: 구조와 결정 흐름"}
