{"decision_links":[{"label":"세 실행 표면의 공통 계약","node_ids":["shared-runner"],"section_id":"shared-runner"},{"label":"history와 persona를 명시적 상태로 관리","node_ids":["session-state"],"section_id":"session-state"},{"label":"provider 호환 범위로 schema 축소","node_ids":["schema-compatibility"],"section_id":"schema-compatibility"},{"label":"구조 실패에서도 raw 기록 보존","node_ids":["json-recovery"],"section_id":"json-recovery"},{"label":"네트워크 오류만 제한 재시도","node_ids":["retry-policy"],"section_id":"retry-policy"},{"label":"XLSX 행마다 session reset","node_ids":["row-isolation"],"section_id":"row-isolation"},{"label":"요청과 응답 전체를 재현 로그로 사용","node_ids":["full-call-log"],"section_id":"full-call-log"}],"flows":[{"from":"shared-runner","id":"flow-01","label":"다음 판단","to":"session-state"},{"from":"session-state","id":"flow-02","label":"다음 판단","to":"schema-compatibility"},{"from":"schema-compatibility","id":"flow-03","label":"다음 판단","to":"json-recovery"},{"from":"json-recovery","id":"flow-04","label":"다음 판단","to":"retry-policy"},{"from":"retry-policy","id":"flow-05","label":"다음 판단","to":"row-isolation"},{"from":"row-isolation","id":"flow-06","label":"다음 판단","to":"full-call-log"},{"from":"full-call-log","id":"flow-07","label":"검증","to":"validation"},{"from":"validation","id":"flow-08","label":"현재 결과","to":"limitations"}],"nodes":[{"description":"개발자는 REPL로 즉시 대화하고, JSON으로 정해진 scenario를 반복하며, 비개발 검토자는 XLSX에서 여러 행을 편집할 수 있다. 세 모드는 같은 호출과 기록 구조를 사용한다.","id":"shared-runner","kind":"service","label":"세 실행 표면의 공통 계약"},{"description":"user와 model history를 SessionState가 소유한다. 모델 응답의 style signal은 현재 persona vector를 바꾸고, 다음 turn의 system prompt 선택에 반영된다.","id":"session-state","kind":"service","label":"history와 persona를 명시적 상태로 관리"},{"description":"지원이 불확실한 JSON Schema 제약을 제거하고 필수 필드 중심으로 축소했다. provider와 schema가 충돌하면 no-schema 옵션으로 실행할 수 있다.","id":"schema-compatibility","kind":"service","label":"provider 호환 범위로 schema 축소"},{"description":"모델이 JSON 앞뒤에 설명을 붙인 경우 첫 번째 완결 객체를 찾아 복구한다. 복구하지 못해도 raw response와 request 기록을 남기고 scenario 전체를 즉시 폐기하지 않는다.","id":"json-recovery","kind":"guardrail","label":"구조 실패에서도 raw 기록 보존"},{"description":"연결, SSL과 timeout 같은 네트워크성 오류는 최대 3회 재시도한다. 일반 HTTP 오류는 현재 즉시 실패해 잘못된 요청을 반복하지 않는다.","id":"retry-policy","kind":"guardrail","label":"네트워크 오류만 제한 재시도"},{"description":"한 행은 하나의 독립 scenario다. 행이 바뀔 때 persona와 history를 reset해 앞선 테스트의 style 상태가 다음 행을 오염시키지 않게 한다.","id":"row-isolation","kind":"state","label":"XLSX 행마다 session reset"},{"description":"system prompt, request body, raw response, parsed result와 persona transition을 함께 기록한다. 최종 텍스트만 저장하는 방식보다 실패 당시 조건을 복원하기 쉽다.","id":"full-call-log","kind":"guardrail","label":"요청과 응답 전체를 재현 로그로 사용"},{"description":"원본 XLSX runner는 model response를 파싱하고 prompt, request와 response 전체를 JSONL로 기록한다. 이 구현 근거가 보장하는 것은 재현 가능한 실행 흔적이며, expected output, judge와 pass/fail 품질 gate까지는 정의하지 않는다.","id":"validation","kind":"guardrail","label":"실행 흔적과 품질 평가는 다름"},{"description":"fixed scenario manifest, 기대 state transition, judge rubric과 합격 목표가 필요하다. 자동 테스트와 live 재실행도 이번 작업에서 확인하지 않았다.","id":"limitations","kind":"output","label":"다음 평가 계약"}],"project_id":"gemini-multiturn-tester-v3","summary":"REPL, JSON과 XLSX가 동일한 session state를 사용하고 persona 변화, 구조 복구와 전체 호출 로그를 남기는 실험 도구의 범위와 미정의 품질 gate를 정리한다.","title":"멀티턴 LLM 테스트 실행 구조: 구조와 결정 흐름"}
